标题,日期,阅读次数,正文
政府工作报告,2022/03/14,114,政府工作报告
国家乡村振兴局党组召开会议传达学习习近平总书记近期关于“三农”工作重要指...,2022/03/12,496,国家乡村振兴局党组召开会议传达学习习近平总书记近期关于“三农”工作重要指示精神扎实做好巩固拓展脱贫攻坚成果和推进乡村振兴有关工作
圆梦新时代开启新征程——2021年全国巩固脱贫成果和推进乡村振兴典型案...,2022/03/14,27,圆梦新时代开启新征程——2021年全国巩固脱贫成果和推进乡村振兴典型案例掠影
成就彪炳史册奋斗开创未来,2022/03/14,57,成就彪炳史册奋斗开创未来
李克强：对因病返贫、因大病致贫的要予以特殊支持,2022/03/11,334,李克强：对因病返贫、因大病致贫的要予以特殊支持
“总书记，乡亲们非常想念您！”——两会代表委员带来各地人民对总书记的心意,2022/03/11,114,“总书记，乡亲们非常想念您！”——两会代表委员带来各地人民对总书记的心意
央视《焦点访谈》：20220310聚焦两会希望的田野,2022/03/11,323,央视《焦点访谈》：20220310聚焦两会希望的田野
习近平时间｜我和习近平代表一起履职：让乡亲们日子越过越好,2022/03/10,330,习近平时间｜我和习近平代表一起履职：让乡亲们日子越过越好
第一观察｜习近平心目中的“大食物观”,2022/03/09,251,第一观察｜习近平心目中的“大食物观”
国家乡村振兴局召开“巾帼心向党、建功新时代”主题座谈会,2022/03/09,363,国家乡村振兴局召开“巾帼心向党、建功新时代”主题座谈会
宣传片来了！,2022/03/09,446,宣传片来了！
提高农业综合生产能力推动社会保障事业高质量发展——习近平总书记在政协农...,2022/03/08,596,提高农业综合生产能力推动社会保障事业高质量发展——习近平总书记在政协农业界、社会福利和社会保障界委员联组会上的重要讲话振奋人心
农业农村部部长唐仁健在两会“部长通道”答记者问,2022/03/05,1096,农业农村部部长唐仁健在两会“部长通道”答记者问
“脱贫摘帽不是终点，而是新生活、新奋斗的起点”——落实习近平总书记两会嘱...,2022/03/04,2153,“脱贫摘帽不是终点，而是新生活、新奋斗的起点”——落实习近平总书记两会嘱托一年回顾
胡春华强调扎实有效做好农民工就业工作,2022/03/03,678,胡春华强调扎实有效做好农民工就业工作
《中国共产党农史纲要》出版发行,2022/03/03,235,《中国共产党农史纲要》出版发行
这一年，总书记这样关心乡村振兴,2022/03/02,1594,这一年，总书记这样关心乡村振兴
中央农办主任、农业农村部部长唐仁健：扎实推动乡村振兴取得新进展,2022/03/02,1257,中央农办主任、农业农村部部长唐仁健：扎实推动乡村振兴取得新进展
奋力续写乡村振兴新篇章,2022/03/02,734,奋力续写乡村振兴新篇章
新华网乡村振兴频道正式上线,2022/02/28,634,新华网乡村振兴频道正式上线
央视《新闻联播》：【奋进新征程建功新时代】摆脱贫困彪炳史册乡村振兴再...,2022/02/25,824,央视《新闻联播》：【奋进新征程建功新时代】摆脱贫困彪炳史册乡村振兴再启新程
国家乡村振兴局与中国电信集团举行工作会谈,2022/02/24,609,国家乡村振兴局与中国电信集团举行工作会谈
如何保障粮食安全？耕地保护怎么落实？怎样巩固脱贫攻坚成果？——有关部门负...,2022/02/24,637,如何保障粮食安全？耕地保护怎么落实？怎样巩固脱贫攻坚成果？——有关部门负责人解读中央一号文件热点话题
央视《新闻直播间》：专家解读2022年中央一号文件来了变了什么？2...,2022/02/24,804,央视《新闻直播间》：专家解读2022年中央一号文件来了变了什么？2022年中央一号文件传递哪些信号？
推动全面推进乡村振兴取得新进展——中央农办主任、农业农村部部长唐仁健解读...,2022/02/23,1787,推动全面推进乡村振兴取得新进展——中央农办主任、农业农村部部长唐仁健解读2022年中央一号文件
奋力开创全面推进乡村振兴新局面（社论）,2022/02/23,949,奋力开创全面推进乡村振兴新局面（社论）
央视《新闻联播》：《中共中央国务院关于做好2022年全面推进乡村振兴重...,2022/02/23,989,央视《新闻联播》：《中共中央国务院关于做好2022年全面推进乡村振兴重点工作的意见》发布
中共中央国务院关于做好2022年全面推进乡村振兴重点工作的意见,2022/02/22,5776,中共中央国务院关于做好2022年全面推进乡村振兴重点工作的意见
重磅！2022年中央一号文件发布,2022/02/22,3471,重磅！2022年中央一号文件发布
“人民对美好生活的向往，就是我们的奋斗目标”,2022/02/16,1306,“人民对美好生活的向往，就是我们的奋斗目标”
《焦点访谈》：总书记的牵挂雪域桃源的美好生活,2022/02/14,509,《焦点访谈》：总书记的牵挂雪域桃源的美好生活
时政微视频|习近平和各族人民在一起,2022/02/13,187,时政微视频|习近平和各族人民在一起
李克强对全国春季农业生产暨加强冬小麦田间管理工作会议作出重要批示,2022/02/13,448,李克强对全国春季农业生产暨加强冬小麦田间管理工作会议作出重要批示
习近平时间丨乡村振兴的法宝,2022/02/11,1760,习近平时间丨乡村振兴的法宝
《焦点访谈》：总书记的牵挂让黄河造福人民,2022/02/10,352,《焦点访谈》：总书记的牵挂让黄河造福人民
习近平的春节故事丨革命老区话扶贫,2022/02/10,312,习近平的春节故事丨革命老区话扶贫
搬得出、稳得住、能发展、可致富黄河滩区“迁”出美好新生活,2022/02/09,599,搬得出、稳得住、能发展、可致富黄河滩区“迁”出美好新生活
国家乡村振兴局党组召开会议传达学习习近平总书记在2022年春节团拜会和赴...,2022/02/08,1468,国家乡村振兴局党组召开会议传达学习习近平总书记在2022年春节团拜会和赴山西看望慰问基层干部群众时的重要讲话精神
三晋气象新——习近平总书记山西考察调研回访记,2022/01/30,739,三晋气象新——习近平总书记山西考察调研回访记
国家乡村振兴局春节前组织各地对防止返贫监测对象、受灾群众和脱贫群众走访慰...,2022/01/30,1358,国家乡村振兴局春节前组织各地对防止返贫监测对象、受灾群众和脱贫群众走访慰问
上海合作组织成员国减贫部门负责人会晤举行,2022/01/30,335,上海合作组织成员国减贫部门负责人会晤举行
国家乡村振兴局党组召开党史学习教育专题民主生活会,2022/01/29,1596,国家乡村振兴局党组召开党史学习教育专题民主生活会
国家乡村振兴局党组召开会议学习贯彻习近平总书记在十九届中央纪委六次全会...,2022/01/27,1215,国家乡村振兴局党组召开会议学习贯彻习近平总书记在十九届中央纪委六次全会上的重要讲话和全会精神
总书记的心心念念,2022/01/25,996,总书记的心心念念
吃生态饭、走致富路“雪域桃源”的乡村振兴新画卷,2022/01/25,718,吃生态饭、走致富路“雪域桃源”的乡村振兴新画卷
习近平时间｜中国乡村数字“范儿”,2022/01/24,728,习近平时间｜中国乡村数字“范儿”
习近平总书记关切事丨水南村里的“厕所革命”,2022/01/24,489,习近平总书记关切事丨水南村里的“厕所革命”
国家乡村振兴局党组召开会议传达学习习近平总书记在省部级主要领导干部专题研...,2022/01/21,1392,国家乡村振兴局党组召开会议传达学习习近平总书记在省部级主要领导干部专题研讨班上的重要讲话精神
习近平时间｜美丽乡村，让农民乐享宜居生活,2022/01/18,1349,习近平时间｜美丽乡村，让农民乐享宜居生活
国家乡村振兴局人力资源社会保障部召开全国脱贫人口稳岗就业工作视频会,2022/01/18,5912,国家乡村振兴局人力资源社会保障部召开全国脱贫人口稳岗就业工作视频会
国家乡村振兴局召开党史学习教育总结会议,2022/01/14,1452,国家乡村振兴局召开党史学习教育总结会议
国家乡村振兴局党组召开党史学习教育专题民主生活会征求意见座谈会,2022/01/13,1269,国家乡村振兴局党组召开党史学习教育专题民主生活会征求意见座谈会
刘焕鑫：把巩固拓展脱贫攻坚成果放在突出位置坚决守住不发生规模性返贫底线,2022/01/12,5025,刘焕鑫：把巩固拓展脱贫攻坚成果放在突出位置坚决守住不发生规模性返贫底线
（总书记和我握过手）“你看，乡亲们笑得多灿烂！”——回访河北正定县塔元庄...,2022/01/11,420,（总书记和我握过手）“你看，乡亲们笑得多灿烂！”——回访河北正定县塔元庄村干部群众
国家乡村振兴局与内蒙古自治区举行工作会谈,2022/01/10,704,国家乡村振兴局与内蒙古自治区举行工作会谈
习近平总书记关切事丨“第一棒”跑得怎么样？——驻村第一书记奋战乡村振兴新...,2022/01/10,961,习近平总书记关切事丨“第一棒”跑得怎么样？——驻村第一书记奋战乡村振兴新征程观察
接续奋斗绘就乡村振兴新图景,2022/01/10,1120,接续奋斗绘就乡村振兴新图景
胡春华在广西督导乡村振兴重点帮扶县巩固拓展脱贫攻坚成果工作,2022/01/10,1021,胡春华在广西督导乡村振兴重点帮扶县巩固拓展脱贫攻坚成果工作
农业农村部、国家乡村振兴局与中国人民保险集团签署战略合作协议推动保险服务...,2022/01/08,533,农业农村部、国家乡村振兴局与中国人民保险集团签署战略合作协议推动保险服务三农高质量发展
农业农村部、国家乡村振兴局与交通银行签订战略合作协议共同推进金融服务乡村...,2022/01/08,411,农业农村部、国家乡村振兴局与交通银行签订战略合作协议共同推进金融服务乡村振兴
国家乡村振兴局与中国银行举行工作会谈,2022/01/07,608,国家乡村振兴局与中国银行举行工作会谈
国家乡村振兴局党组召开会议学习贯彻习近平总书记重要讲话精神研究部署今...,2022/01/06,1810,国家乡村振兴局党组召开会议学习贯彻习近平总书记重要讲话精神研究部署今年第一季度重点工作
国家乡村振兴局与中国农业银行举行工作会谈,2022/01/06,527,国家乡村振兴局与中国农业银行举行工作会谈
黄坤明在江西调研时强调持续深入学习宣传党的十九届六中全会精神激励干部...,2022/01/06,319,黄坤明在江西调研时强调持续深入学习宣传党的十九届六中全会精神激励干部群众满怀信心奋进新征程建功新时代
农业农村部党组召开会议认真学习习近平主席新年贺词研究部署一季度农业农村重...,2022/01/05,1038,农业农村部党组召开会议认真学习习近平主席新年贺词研究部署一季度农业农村重点工作
刘焕鑫:沿着习近平总书记指引的方向奋力前进向着推进乡村全面振兴的目标奋...,2022/01/01,2152,刘焕鑫:沿着习近平总书记指引的方向奋力前进向着推进乡村全面振兴的目标奋勇前行
国家乡村振兴局党组召开会议传达学习中央有关精神,2021/12/31,1229,国家乡村振兴局党组召开会议传达学习中央有关精神
央视《朝闻天下》：教育部多措并举推进乡村振兴人才培养,2021/12/30,639,央视《朝闻天下》：教育部多措并举推进乡村振兴人才培养
习近平时间丨乡村振兴，描绘新时代“富村山居图”,2021/12/29,832,习近平时间丨乡村振兴，描绘新时代“富村山居图”
国家乡村振兴局党组书记、局长刘焕鑫到开发指导司党支部联系点调研指导工作,2021/12/29,580,国家乡村振兴局党组书记、局长刘焕鑫到开发指导司党支部联系点调研指导工作
国家乡村振兴局:“两节”将至重点发力做好帮扶工作,2021/12/28,990,国家乡村振兴局:“两节”将至重点发力做好帮扶工作
稳住农业基本盘做好“三农”工作——从中央农村工作会议看2022年“三农...,2021/12/28,1457,稳住农业基本盘做好“三农”工作——从中央农村工作会议看2022年“三农”重点任务
全国乡村振兴局长会议在京召开,2021/12/27,6447,全国乡村振兴局长会议在京召开
确保农业稳产增产、农民稳步增收、农村稳定安宁——访中央农办主任、农业农村...,2021/12/27,1025,确保农业稳产增产、农民稳步增收、农村稳定安宁——访中央农办主任、农业农村部部长唐仁健
央视《朝闻天下》稳字当头稳中求进：怎么看怎么办充分尊重农民意愿积...,2021/12/27,420,央视《朝闻天下》稳字当头稳中求进：怎么看怎么办充分尊重农民意愿积极稳妥推进乡村振兴
中央农村工作会议在京召开习近平对做好“三农”工作作出重要指示李克强提...,2021/12/26,1575,中央农村工作会议在京召开习近平对做好“三农”工作作出重要指示李克强提出要求
国家乡村振兴局党组召开会议研究部署脱贫人口稳岗就业工作,2021/12/26,904,国家乡村振兴局党组召开会议研究部署脱贫人口稳岗就业工作
新时代新征程，总书记这样谋划乡村振兴大棋局,2021/12/26,1135,新时代新征程，总书记这样谋划乡村振兴大棋局
“三农”压舱石，稳稳的,2021/12/26,337,“三农”压舱石，稳稳的
东亚减贫示范合作技术援助项目总结会召开,2021/12/24,172,东亚减贫示范合作技术援助项目总结会召开
唐仁健：中国共产党在“三农”领域的百年成就及其历史经验,2021/12/23,894,唐仁健：中国共产党在“三农”领域的百年成就及其历史经验
2021年度巩固拓展脱贫攻坚成果同乡村振兴有效衔接考核评估工作动员部署会...,2021/12/23,1305,2021年度巩固拓展脱贫攻坚成果同乡村振兴有效衔接考核评估工作动员部署会强调以高度的责任感和使命感组织实施好巩固拓展脱贫攻坚成果同乡村振兴有效衔接考核评估
《中国农村人居环境发展报告（2021）》在京发布,2021/12/23,520,《中国农村人居环境发展报告（2021）》在京发布
央视《朝闻天下》：国家乡村振兴局返贫致贫风险总体可控攻坚成果得到巩固,2021/12/23,459,央视《朝闻天下》：国家乡村振兴局返贫致贫风险总体可控攻坚成果得到巩固
学习贯彻习近平总书记乡村振兴重要论述座谈活动在京举办,2021/12/22,820,学习贯彻习近平总书记乡村振兴重要论述座谈活动在京举办
国家乡村振兴局党组召开扩大会议传达学习中央有关精神,2021/12/19,1469,国家乡村振兴局党组召开扩大会议传达学习中央有关精神
国家乡村振兴局指导、清华大学牵头组建的乡村建设高校联盟在京成立,2021/12/19,714,国家乡村振兴局指导、清华大学牵头组建的乡村建设高校联盟在京成立
第三批全国农村公共服务典型案例在京发布,2021/12/19,630,第三批全国农村公共服务典型案例在京发布
总书记给咱来信了！,2021/12/17,762,总书记给咱来信了！
2021年“宪法进农村”主场活动在四川举办,2021/12/17,200,2021年“宪法进农村”主场活动在四川举办
国家乡村振兴局中华全国工商业联合会关于印发《“万企兴万村”行动倾斜支持...,2021/12/14,5148,国家乡村振兴局中华全国工商业联合会关于印发《“万企兴万村”行动倾斜支持国家乡村振兴重点帮扶县专项工作方案》的通知
国家乡村振兴局党组召开会议传达学习中央经济工作会议精神,2021/12/13,1216,国家乡村振兴局党组召开会议传达学习中央经济工作会议精神
农业农村部党组召开会议强调认真学习贯彻中央经济工作会议精神稳字当头稳...,2021/12/13,918,农业农村部党组召开会议强调认真学习贯彻中央经济工作会议精神稳字当头稳中求进扎实做好明年三农工作
今年前三季度，农村居民人均工资性收入同比名义增长15.3%“饭碗”端得...,2021/12/13,402,今年前三季度，农村居民人均工资性收入同比名义增长15.3%“饭碗”端得牢农民鼓腰包
国家乡村振兴局与湖南省举行工作会谈,2021/12/11,563,国家乡村振兴局与湖南省举行工作会谈
乡村振兴，巩固脱贫成果的中国实践,2021/12/10,1612,乡村振兴，巩固脱贫成果的中国实践
农业农村部：《“十四五”推进农业农村现代化规划》将聚焦七大重点任务,2021/12/10,2769,农业农村部：《“十四五”推进农业农村现代化规划》将聚焦七大重点任务
唐仁健：以务实管用的方法加强和改进乡村治理,2021/12/09,1341,唐仁健：以务实管用的方法加强和改进乡村治理
乡村振兴，未来可期——聚焦《“十四五”推进农业农村现代化规划》新举措,2021/12/09,1382,乡村振兴，未来可期——聚焦《“十四五”推进农业农村现代化规划》新举措
2021中非合作论坛—减贫与发展会议成功举办,2021/12/08,550,2021中非合作论坛—减贫与发展会议成功举办
“洋记者”探秘贵州小城石阡乡村振兴故事,2021/12/08,291,“洋记者”探秘贵州小城石阡乡村振兴故事
农业农村部：深入学习贯彻习近平总书记重要讲话精神主动入位推动做好新时代...,2021/12/07,519,农业农村部：深入学习贯彻习近平总书记重要讲话精神主动入位推动做好新时代农村宗教工作
5年，农村人居环境将有这些新变化,2021/12/07,871,5年，农村人居环境将有这些新变化
国家乡村振兴局党组召开会议强调深入学习贯彻习近平总书记重要讲话精神扎...,2021/12/07,3199,国家乡村振兴局党组召开会议强调深入学习贯彻习近平总书记重要讲话精神扎实推进巩固拓展脱贫攻坚成果和乡村振兴重点工作
国新办举行农村人居环境整治提升五年行动新闻发布会,2021/12/06,625,国新办举行农村人居环境整治提升五年行动新闻发布会
从“摆脱脏乱差”到“追求乡村美”农村人居环境整治提升迈入新征程,2021/12/06,516,从“摆脱脏乱差”到“追求乡村美”农村人居环境整治提升迈入新征程
国家乡村振兴局召开东部地区乡村振兴局局长座谈会研究谋划2022年乡村振...,2021/12/04,1280,国家乡村振兴局召开东部地区乡村振兴局局长座谈会研究谋划2022年乡村振兴和东西部协作工作
国家乡村振兴局与中信集团举行工作会谈,2021/12/04,572,国家乡村振兴局与中信集团举行工作会谈
《乡村振兴——我们在路上》主题宣传活动展现基层奋斗故事,2021/12/07,187,《乡村振兴——我们在路上》主题宣传活动展现基层奋斗故事
央视《朝闻天下》：消费帮扶助力乡村产业振兴,2021/12/03,833,央视《朝闻天下》：消费帮扶助力乡村产业振兴
国家乡村振兴局召开中部地区乡村振兴局局长座谈会研究谋划2022年工作思...,2021/12/02,1804,国家乡村振兴局召开中部地区乡村振兴局局长座谈会研究谋划2022年工作思路和重点举措
我国将构建支持特殊类型地区振兴“1+N”政策体系,2021/12/02,903,我国将构建支持特殊类型地区振兴“1+N”政策体系
扎实推进乡村振兴重点工作,2021/12/02,1994,扎实推进乡村振兴重点工作
服务乡村振兴树立品牌形象,2021/12/02,632,服务乡村振兴树立品牌形象
以品牌意识推进乡村振兴,2021/12/01,1010,以品牌意识推进乡村振兴
国家乡村振兴局党组召开理论学习中心组（扩大）学习交流会深入学习贯彻党的...,2021/11/30,3138,国家乡村振兴局党组召开理论学习中心组（扩大）学习交流会深入学习贯彻党的十九届六中全会精神研究谋划巩固拓展脱贫攻坚成果和推进乡村振兴有关工作
一群特别的演员，一场走心的演出,2021/11/30,268,一群特别的演员，一场走心的演出
习近平的扶贫故事丨“脱贫攻坚是我心里最牵挂的一件大事”,2021/11/26,2084,习近平的扶贫故事丨“脱贫攻坚是我心里最牵挂的一件大事”
胡春华在陕西督导国家乡村振兴重点帮扶县巩固拓展脱贫攻坚成果工作,2021/11/29,937,胡春华在陕西督导国家乡村振兴重点帮扶县巩固拓展脱贫攻坚成果工作
新征程｜咬定青山不放松——党的十九届六中全会精神引发乡村振兴工作者热烈反...,2021/11/25,797,新征程｜咬定青山不放松——党的十九届六中全会精神引发乡村振兴工作者热烈反响
习近平的扶贫故事丨考察生态移民区“把脉”脱贫攻坚,2021/11/24,460,习近平的扶贫故事丨考察生态移民区“把脉”脱贫攻坚
国家乡村振兴局召开西部地区乡村振兴局局长座谈会,2021/11/24,1186,国家乡村振兴局召开西部地区乡村振兴局局长座谈会
国家乡村振兴局召开全国乡村振兴局长视频会议,2021/11/19,1903,国家乡村振兴局召开全国乡村振兴局长视频会议
国家乡村振兴局召开乡村振兴专家座谈会,2021/11/19,1441,国家乡村振兴局召开乡村振兴专家座谈会
在乡村治理中推广运用清单制暨农村移风易俗视频会强调全面加强和改进乡村治理...,2021/11/17,1253,在乡村治理中推广运用清单制暨农村移风易俗视频会强调全面加强和改进乡村治理夯实乡村振兴基层基础
国家乡村振兴局召开党员干部大会传达学习党的十九届六中全会精神,2021/11/17,1051,国家乡村振兴局召开党员干部大会传达学习党的十九届六中全会精神
全国“万企兴万村”行动领导小组召开第一次全体会议,2021/11/17,997,全国“万企兴万村”行动领导小组召开第一次全体会议
中共中央关于党的百年奋斗重大成就和历史经验的决议,2021/11/16,519,中共中央关于党的百年奋斗重大成就和历史经验的决议
国家乡村振兴局党组召开会议传达学习党的十九届六中全会精神,2021/11/13,3723,国家乡村振兴局党组召开会议传达学习党的十九届六中全会精神
习近平时间｜乡村振兴更美好的生活就在前方,2021/11/12,3470,习近平时间｜乡村振兴更美好的生活就在前方
中国共产党第十九届中央委员会第六次全体会议公报,2021/11/12,2256,中国共产党第十九届中央委员会第六次全体会议公报
在新时代新征程上赢得更加伟大的胜利和荣光,2021/11/12,1873,在新时代新征程上赢得更加伟大的胜利和荣光
时政微纪录丨人民就是江山,2021/11/11,1820,时政微纪录丨人民就是江山
农村产业振兴划重点一系列支持政策将落地,2021/11/09,3432,农村产业振兴划重点一系列支持政策将落地
弘扬脱贫攻坚精神全面推进乡村振兴,2021/11/08,6471,弘扬脱贫攻坚精神全面推进乡村振兴
国家乡村振兴局党组召开会议强调深入学习贯彻习近平总书记重要讲话精神扎...,2021/11/06,3515,国家乡村振兴局党组召开会议强调深入学习贯彻习近平总书记重要讲话精神扎实做好乡村振兴有关具体工作
【弘扬伟大建党精神开创历史新伟业】摆脱贫困：中国书写人类发展史上的光辉...,2021/11/05,2110,【弘扬伟大建党精神开创历史新伟业】摆脱贫困：中国书写人类发展史上的光辉篇章
李克强主持召开国务院常务会议,2021/11/04,2477,李克强主持召开国务院常务会议
丁仲礼率调研组来桂调研乡村振兴工作,2021/11/03,2510,丁仲礼率调研组来桂调研乡村振兴工作
创造彪炳史册的人间奇迹——以习近平同志为核心的党中央引领亿万人民打赢脱贫...,2021/11/03,2634,创造彪炳史册的人间奇迹——以习近平同志为核心的党中央引领亿万人民打赢脱贫攻坚战述评
刘焕鑫赴云南调研巩固拓展脱贫攻坚成果同乡村振兴有效衔接工作,2021/11/02,3035,刘焕鑫赴云南调研巩固拓展脱贫攻坚成果同乡村振兴有效衔接工作
唐仁健在广西调研时强调做大做强特色产业扎实推进乡村建设确保全面推进...,2021/11/01,2481,唐仁健在广西调研时强调做大做强特色产业扎实推进乡村建设确保全面推进乡村振兴开好局起好步
农业农村部就乡村治理创新典型相关情况举行发布会,2021/11/01,2724,农业农村部就乡村治理创新典型相关情况举行发布会
传承红色基因牢记初心使命奋力开创乡村振兴新局面——国家乡村振兴局党员...,2021/10/29,3104,传承红色基因牢记初心使命奋力开创乡村振兴新局面——国家乡村振兴局党员干部赴香山革命纪念馆和香山革命纪念地开展红色教育
