标题,日期,阅读次数,正文
精准扶贫彰显超强国家治理能力扶贫减贫的中国智慧,2017/09/04,4248,精准扶贫彰显超强国家治理能力扶贫减贫的中国智慧
陆昊分别主持召开省政府专题会议强调精准测算加大投入加快进度解决贫困户住...,2017/09/01,3572,陆昊分别主持召开省政府专题会议强调精准测算加大投入加快进度解决贫困户住房和农村饮水安全问题
习近平：在深度贫困地区脱贫攻坚座谈会上的讲话,2017/09/01,15434,习近平：在深度贫困地区脱贫攻坚座谈会上的讲话
【新闻联播】习近平总书记在深度贫困地区脱贫攻坚座谈会上的重要讲话公开发表,2017/09/01,3427,【新闻联播】习近平总书记在深度贫困地区脱贫攻坚座谈会上的重要讲话公开发表
【新闻联播】全国政协十二届常委会第二十二次会议闭幕会议围绕“实施精准扶贫...,2017/08/31,2238,【新闻联播】全国政协十二届常委会第二十二次会议闭幕会议围绕“实施精准扶贫中存在的问题和建议”议政建言
汪洋出席东西部扶贫协作经验交流会并讲话,2017/08/31,2335,汪洋出席东西部扶贫协作经验交流会并讲话
【新闻联播】十二届全国人大常委会第二十九次会议举行联组会议审议并专题询...,2017/08/31,2087,【新闻联播】十二届全国人大常委会第二十九次会议举行联组会议审议并专题询问脱贫攻坚工作情况报告
刘永富主任会见国际农业发展基金总裁,2017/08/30,3075,刘永富主任会见国际农业发展基金总裁
中共国务院扶贫开发领导小组办公室党组关于“机动式”巡视整改情况的通报,2017/08/30,6538,中共国务院扶贫开发领导小组办公室党组关于“机动式”巡视整改情况的通报
【新闻联播】政协第十二届全国委员会常务委员会第二十二次会议举行全体会议...,2017/08/29,3042,【新闻联播】政协第十二届全国委员会常务委员会第二十二次会议举行全体会议俞正声出席
【新闻联播】习近平主持召开中央全面深化改革领导小组第三十八次会议强调加...,2017/08/29,3779,【新闻联播】习近平主持召开中央全面深化改革领导小组第三十八次会议强调加强领导总结经验运用规律站在更高起点谋划和推进改革
【新闻联播】李克强对东西部扶贫协作经验交流会作出重要批示强调进一步创新...,2017/08/29,3313,【新闻联播】李克强对东西部扶贫协作经验交流会作出重要批示强调进一步创新完善协作模式加强精准帮扶带动更多贫困群众实现稳定脱贫
全国政协十二届常委会第二十二次会议举行专题分组讨论俞正声出席,2017/08/29,2936,全国政协十二届常委会第二十二次会议举行专题分组讨论俞正声出席
全国政协十二届常委会第二十二次会议开幕俞正声出席,2017/08/29,3223,全国政协十二届常委会第二十二次会议开幕俞正声出席
贫困村来了博士书记——广西住房城乡建设厅扶贫记事,2017/08/29,5529,贫困村来了博士书记——广西住房城乡建设厅扶贫记事
东西手拉手共同奔小康——扶贫协作资金今年拟投入近五十亿元,2017/08/29,2915,东西手拉手共同奔小康——扶贫协作资金今年拟投入近五十亿元
全国脱贫攻坚培训工作研讨班在山东省淄博市举办,2017/08/26,3942,全国脱贫攻坚培训工作研讨班在山东省淄博市举办
刘永富主任出席军队健康扶贫工作推进会议,2017/08/25,3432,刘永富主任出席军队健康扶贫工作推进会议
湖南省委副书记乌兰在芷江调研脱贫攻坚工作时强调强化产业支撑提质脱贫攻坚,2017/08/25,3220,湖南省委副书记乌兰在芷江调研脱贫攻坚工作时强调强化产业支撑提质脱贫攻坚
湖北省委副书记陈一新在武汉市第七次拼搏赶超交流会上强调创新精准扶贫硬举...,2017/08/25,3146,湖北省委副书记陈一新在武汉市第七次拼搏赶超交流会上强调创新精准扶贫硬举措坚决打赢脱贫攻坚战
安徽省教育扶贫工作电视电话会议召开,2017/08/24,4132,安徽省教育扶贫工作电视电话会议召开
【新闻联播】中央纪委公开曝光九起扶贫领域腐败问题典型案例,2017/08/24,3287,【新闻联播】中央纪委公开曝光九起扶贫领域腐败问题典型案例
发改委解读:上半年工作进展与下一步工作重点,2017/08/23,3211,发改委解读:上半年工作进展与下一步工作重点
用“光彩”照亮四川脱贫路省长尹力的嘱咐句句“走心”,2017/08/23,2844,用“光彩”照亮四川脱贫路省长尹力的嘱咐句句“走心”
湖北省纪委书记入户暗访监督精准扶贫落实情况,2017/08/23,4543,湖北省纪委书记入户暗访监督精准扶贫落实情况
十八大以来中国特色社会主义国家治理的根本逻辑,2017/08/21,3849,十八大以来中国特色社会主义国家治理的根本逻辑
刘永富：确保深度贫困地区一道迈进全面小康社会,2017/08/21,4192,刘永富：确保深度贫困地区一道迈进全面小康社会
刘永富主任应邀赴中办作脱贫攻坚报告,2017/08/19,5991,刘永富主任应邀赴中办作脱贫攻坚报告
专访国务院扶贫办主任刘永富:坚决打赢反贫困斗争的伟大决战,2017/08/18,10756,专访国务院扶贫办主任刘永富:坚决打赢反贫困斗争的伟大决战
【人民日报】中国多维扶贫走在世界前列,2017/08/16,2139,【人民日报】中国多维扶贫走在世界前列
【人民日报】云南加强扶贫领域监督执纪贫困村检查一年内全覆盖,2017/08/16,3119,【人民日报】云南加强扶贫领域监督执纪贫困村检查一年内全覆盖
省委书记云南陈豪怒江调研：以脱贫成效检验“四个意识”,2017/08/14,3776,省委书记云南陈豪怒江调研：以脱贫成效检验“四个意识”
湖南省省长许达哲：以脱贫攻坚统筹经济社会发展确保完成全年各项工作任务,2017/08/14,3200,湖南省省长许达哲：以脱贫攻坚统筹经济社会发展确保完成全年各项工作任务
湖南省委副书记乌兰：下足绣花功夫确保顺利摘帽,2017/08/14,3273,湖南省委副书记乌兰：下足绣花功夫确保顺利摘帽
新华网专题：中国反贫困斗争的伟大决战,2017/08/14,None,None
中国—东盟社会发展与减贫论坛举行,2017/08/11,3682,中国—东盟社会发展与减贫论坛举行
湖南省政协主席李微微：更加精准聚焦问题更加有效做好帮扶,2017/08/09,3826,湖南省政协主席李微微：更加精准聚焦问题更加有效做好帮扶
山东省委书记刘家义：坚持精准扶贫精准脱贫不断夺取脱贫攻坚工作新胜利,2017/08/09,11791,山东省委书记刘家义：坚持精准扶贫精准脱贫不断夺取脱贫攻坚工作新胜利
2017年网络扶贫工作推进视频会议在京召开,2017/08/03,4044,2017年网络扶贫工作推进视频会议在京召开
国务院扶贫办党组深入学习贯彻习近平总书记在省部级主要领导干部专题研讨班上...,2017/08/03,4131,国务院扶贫办党组深入学习贯彻习近平总书记在省部级主要领导干部专题研讨班上的重要讲话精神
黑龙江省委书记张庆伟：突出抓好问题整改加强监督执纪问责聚焦关键环节确保脱...,2017/08/02,3441,黑龙江省委书记张庆伟：突出抓好问题整改加强监督执纪问责聚焦关键环节确保脱贫攻坚扎实见效
黑龙江省省长陆昊：突出“精准”要求打赢脱贫攻坚战发挥资源优势和区域中心城...,2017/08/01,3492,黑龙江省省长陆昊：突出“精准”要求打赢脱贫攻坚战发挥资源优势和区域中心城市功能加快发展
刘永富主任会见菲律宾国家减贫委员会黎萨•马萨主席,2017/08/01,4660,刘永富主任会见菲律宾国家减贫委员会黎萨•马萨主席
汪洋：用好督查巡查成果推动深度贫困地区攻坚,2017/08/01,5152,汪洋：用好督查巡查成果推动深度贫困地区攻坚
决胜全面小康不负人民期待--习近平总书记在省部级专题研讨班上的重要讲话...,2017/07/31,5777,决胜全面小康不负人民期待--习近平总书记在省部级专题研讨班上的重要讲话在基层干部群众中引起强烈反响
黑龙江省委副书记陈海波：保障住房饮水安全确保扶贫脱贫成效,2017/07/28,2581,黑龙江省委副书记陈海波：保障住房饮水安全确保扶贫脱贫成效
云南省省长阮成发：争当改革开放排头兵坚决打赢脱贫攻坚战,2017/07/25,2025,云南省省长阮成发：争当改革开放排头兵坚决打赢脱贫攻坚战
黑龙江省委书记张庆伟：坚定信心攻坚克难打赢脱贫攻坚战加快产业项目建设培...,2017/07/25,2855,黑龙江省委书记张庆伟：坚定信心攻坚克难打赢脱贫攻坚战加快产业项目建设培育发展新动能
湖南省委书记杜家毫出席湖南省脱贫攻坚巡查整改工作会议,2017/07/25,3232,湖南省委书记杜家毫出席湖南省脱贫攻坚巡查整改工作会议
湖北省委书记蒋超良：扛好政治责任聚焦精准发力坚决打赢脱贫攻坚“硬仗中的...,2017/07/25,2833,湖北省委书记蒋超良：扛好政治责任聚焦精准发力坚决打赢脱贫攻坚“硬仗中的硬仗”
湖北省委书记蒋超良：发展特色产业支撑精准脱贫,2017/07/25,2776,湖北省委书记蒋超良：发展特色产业支撑精准脱贫
【人民日报】国务院扶贫办要求力戒形式主义填表报数检查考评，减！,2017/07/25,3966,【人民日报】国务院扶贫办要求力戒形式主义填表报数检查考评，减！
王东明赴凉山州甘孜州调研：指导推动民族地区脱贫攻坚、生态环境保护和全域旅...,2017/07/24,2475,王东明赴凉山州甘孜州调研：指导推动民族地区脱贫攻坚、生态环境保护和全域旅游发展工作
四川省委书记王东明：坚持旅游惠民富民让民族地区群众背靠山水美景过上好日...,2017/07/24,2586,四川省委书记王东明：坚持旅游惠民富民让民族地区群众背靠山水美景过上好日子
国务院扶贫办关于进一步克服形式主义减轻基层负担的通知,2017/07/24,76150,国务院扶贫办关于进一步克服形式主义减轻基层负担的通知
【新闻联播】江西：美了村富了民乡村旅游助脱贫,2017/07/24,1249,【新闻联播】江西：美了村富了民乡村旅游助脱贫
【新闻联播】宁夏：闽宁协作再结硕果,2017/07/21,1819,【新闻联播】宁夏：闽宁协作再结硕果
一年来，习近平推动东西扶贫协作再上新台阶,2017/07/21,5298,一年来，习近平推动东西扶贫协作再上新台阶
深入贯彻落实习近平总书记东西部扶贫协作会议重要讲话精神座谈会召开,2017/07/21,4572,深入贯彻落实习近平总书记东西部扶贫协作会议重要讲话精神座谈会召开
2017年全国脱贫攻坚奖评选委员会顺利组建,2017/07/20,2937,2017年全国脱贫攻坚奖评选委员会顺利组建
民政部、国务院扶贫办联合召开农村低保制度与扶贫开发政策衔接座谈会,2017/07/20,4128,民政部、国务院扶贫办联合召开农村低保制度与扶贫开发政策衔接座谈会
安徽省省长李国英在金寨县调研油茶产业扶贫工作,2017/07/20,3079,安徽省省长李国英在金寨县调研油茶产业扶贫工作
【人民日报】为全球贫困治理贡献中国方案（国际论坛）,2017/07/20,3118,【人民日报】为全球贫困治理贡献中国方案（国际论坛）
【纪检人·镜头】专项巡察助力脱贫攻坚,2017/07/19,4035,【纪检人·镜头】专项巡察助力脱贫攻坚
扶贫办:把全面从严治党要求贯穿脱贫攻坚全过程,2017/07/18,5896,扶贫办:把全面从严治党要求贯穿脱贫攻坚全过程
【新闻联播】贵州：干部驻村助力百姓脱贫,2017/07/17,2544,【新闻联播】贵州：干部驻村助力百姓脱贫
刘永富同志会见云南省委书记陈豪一行,2017/07/14,3303,刘永富同志会见云南省委书记陈豪一行
国务院扶贫办主任刘永富与“产业精准扶贫研讨班”学员座谈,2017/07/13,3054,国务院扶贫办主任刘永富与“产业精准扶贫研讨班”学员座谈
陕西省委召开常委会议传达李克强总理来陕考察重要指示精神研究部署扶贫领域...,2017/07/13,2972,陕西省委召开常委会议传达李克强总理来陕考察重要指示精神研究部署扶贫领域监督执纪问责等工作娄勤俭主持会议
十八大以来，我国每年超过1000万人脱贫——扶贫精准有力减贫提质加速（...,2017/07/13,5564,十八大以来，我国每年超过1000万人脱贫——扶贫精准有力减贫提质加速（大数据里看中国）
湖南省委副书记乌兰在株洲调研时强调把产业发展作为脱贫攻坚的重中之重,2017/07/12,2440,湖南省委副书记乌兰在株洲调研时强调把产业发展作为脱贫攻坚的重中之重
湖南：省委书记杜家毫在邵阳调研时强调一手抓脱贫攻坚一手抓产业发展以优...,2017/07/12,3463,湖南：省委书记杜家毫在邵阳调研时强调一手抓脱贫攻坚一手抓产业发展以优异成绩迎接党的十九大胜利召开
李克强在陕西考察时强调：加快改革创新补上民生短板在推动西部开发开放中促...,2017/07/12,2325,李克强在陕西考察时强调：加快改革创新补上民生短板在推动西部开发开放中促进经济发展升级
李克强：易地扶贫搬迁要算精“可持续”细账,2017/07/11,553,李克强：易地扶贫搬迁要算精“可持续”细账
李克强崎岖山路颠簸一小时考察脱贫攻坚,2017/07/11,1830,李克强崎岖山路颠簸一小时考察脱贫攻坚
刘延东在全国打赢教育脱贫攻坚战现场会上强调精准施策持续加力坚决打赢教...,2017/07/10,3299,刘延东在全国打赢教育脱贫攻坚战现场会上强调精准施策持续加力坚决打赢教育脱贫攻坚战
西藏自治区主席齐扎拉：严格精准识别下足“绣花”功夫为打赢脱贫攻坚战奠...,2017/07/10,2782,西藏自治区主席齐扎拉：严格精准识别下足“绣花”功夫为打赢脱贫攻坚战奠定坚实基础
内蒙古：刘奇凡在乌兰察布市调研时强调：严查扶贫领域的腐败问题,2017/07/10,3210,内蒙古：刘奇凡在乌兰察布市调研时强调：严查扶贫领域的腐败问题
湖南：推进脱贫攻坚是为守住底线加快脱贫攻坚就是加快发展,2017/07/07,3017,湖南：推进脱贫攻坚是为守住底线加快脱贫攻坚就是加快发展
人民日报：资产收益扶贫，推广保底收益＋按股分红，优先保障贫困户利益,2017/07/07,5352,人民日报：资产收益扶贫，推广保底收益＋按股分红，优先保障贫困户利益
湖南省省长许达哲主持召开省政府常务会议研究部署防汛抗灾、脱贫攻坚等工作,2017/07/06,2977,湖南省省长许达哲主持召开省政府常务会议研究部署防汛抗灾、脱贫攻坚等工作
四川省委书记王东明：统筹抓好发展民生稳定三件大事,2017/07/06,3536,四川省委书记王东明：统筹抓好发展民生稳定三件大事
刘云山在河南调研时强调切实担起抓党建促脱贫攻坚责任以苦干实干带领群众...,2017/07/06,3800,刘云山在河南调研时强调切实担起抓党建促脱贫攻坚责任以苦干实干带领群众致富奔小康
2017年脱贫攻坚督查巡查近日启动,2017/07/05,2017-07-05,2017年脱贫攻坚督查巡查近日启动
广西壮族自治区党委书记彭清华：全力攻克坚中之坚贫中之贫困中之困,2017/07/05,3138,广西壮族自治区党委书记彭清华：全力攻克坚中之坚贫中之贫困中之困
安徽省委书记李锦斌：聚焦精准补齐短板强力主攻坚中之坚奋力实现脱贫攻坚年...,2017/07/05,3182,安徽省委书记李锦斌：聚焦精准补齐短板强力主攻坚中之坚奋力实现脱贫攻坚年度战役再战再捷
国新办举行“互联网+”社会扶贫有关情况新闻发布会,2017/07/05,None,None
国务院扶贫办召开驻村调研汇报会,2017/07/03,3291,国务院扶贫办召开驻村调研汇报会
王岐山在扶贫领域监督执纪问责工作电视电话会上强调为打赢脱贫攻坚战提供坚强...,2017/07/03,5933,王岐山在扶贫领域监督执纪问责工作电视电话会上强调为打赢脱贫攻坚战提供坚强保障
全国万企帮万村精准扶贫行动片区座谈会在甘肃召开,2017/07/03,3526,全国万企帮万村精准扶贫行动片区座谈会在甘肃召开
汪洋在国务院扶贫开发领导小组全体会议上强调坚决打赢深度贫困地区脱贫攻坚战,2017/07/03,3313,汪洋在国务院扶贫开发领导小组全体会议上强调坚决打赢深度贫困地区脱贫攻坚战
“对口帮扶携手奔小康”专题培训班圆满结业20个贫困县与上海企业签署脱贫攻...,2017/06/28,3025,“对口帮扶携手奔小康”专题培训班圆满结业20个贫困县与上海企业签署脱贫攻坚意向合作协议
陈志刚副主任出席中非减贫发展高端对话会暨智库论坛,2017/06/28,2626,陈志刚副主任出席中非减贫发展高端对话会暨智库论坛
国务院扶贫办传达贯彻深度贫困地区脱贫攻坚座谈会精神,2017/06/27,2017-06-27,国务院扶贫办传达贯彻深度贫困地区脱贫攻坚座谈会精神
习近平：强化支撑体系加大政策倾斜聚焦精准发力攻克坚中之坚,2017/06/24,2960,习近平：强化支撑体系加大政策倾斜聚焦精准发力攻克坚中之坚
湖南省委书记杜家毫：担当时代使命保持奋斗初心齐心协力打赢脱贫攻坚战,2017/06/23,2919,湖南省委书记杜家毫：担当时代使命保持奋斗初心齐心协力打赢脱贫攻坚战
洪天云副主任出席对口帮扶携手奔小康专题培训班并授课,2017/06/23,2660,洪天云副主任出席对口帮扶携手奔小康专题培训班并授课
[独家V观]习近平深入吕梁山区调研深度贫困地区脱贫攻坚大计,2017/06/23,3888,[独家V观]习近平深入吕梁山区调研深度贫困地区脱贫攻坚大计
习近平总书记到山西考察调研,2017/06/22,3510,习近平总书记到山西考察调研
全国加强财政专项扶贫资金监管培训班在重庆举办,2017/06/20,2410,全国加强财政专项扶贫资金监管培训班在重庆举办
国务院扶贫办主任刘永富主任会见湖南省委副书记乌兰、省政协副主席戴道晋一行,2017/06/20,3076,国务院扶贫办主任刘永富主任会见湖南省委副书记乌兰、省政协副主席戴道晋一行
突出目标结果导向完善资金分配,2017/06/20,2980,突出目标结果导向完善资金分配
国务院扶贫办主任刘永富会见新疆维吾尔自治区副主席张春林一行,2017/06/16,3582,国务院扶贫办主任刘永富会见新疆维吾尔自治区副主席张春林一行
广西壮族自治区党委书记彭清华：坚决打响我区国家扶贫开发工作重点县脱贫摘...,2017/06/16,4066,广西壮族自治区党委书记彭清华：坚决打响我区国家扶贫开发工作重点县脱贫摘帽第一炮
湖北省委书记蒋超良：以产业发展带动脱贫一针一线下好绣花功夫,2017/06/16,3538,湖北省委书记蒋超良：以产业发展带动脱贫一针一线下好绣花功夫
2020告别贫困！习近平要求限时完成的目标,2017/06/16,6648,2020告别贫困！习近平要求限时完成的目标
国务院扶贫办主任刘永富会见了甘肃省委副书记孙伟一行,2017/06/15,4139,国务院扶贫办主任刘永富会见了甘肃省委副书记孙伟一行
国务院扶贫办主任刘永富会见江西省副省长吴晓军一行,2017/06/14,3620,国务院扶贫办主任刘永富会见江西省副省长吴晓军一行
国务院扶贫办召开中央“机动式”巡视整改工作动员部署会,2017/06/13,5551,国务院扶贫办召开中央“机动式”巡视整改工作动员部署会
【新闻联播】十八届中央第十二轮巡视开始反馈,2017/06/11,3154,【新闻联播】十八届中央第十二轮巡视开始反馈
"中央第八巡视组向国务院扶贫开发领导小组办公室党组反馈""机动式""巡视情况",2017/06/11,7569,"中央第八巡视组向国务院扶贫开发领导小组办公室党组反馈""机动式""巡视情况"
全国扶贫开发考核评估工作培训班在重庆举办,2017/06/09,2951,全国扶贫开发考核评估工作培训班在重庆举办
湖北省省长王晓东：精准施策破解发展难题多措并举推进脱贫攻坚,2017/06/07,2658,湖北省省长王晓东：精准施策破解发展难题多措并举推进脱贫攻坚
国务院扶贫办启动驻村调研,2017/06/07,2017-06-07,国务院扶贫办启动驻村调研
汪洋在全国农业产业扶贫经验交流会上强调树立正确政绩观扎实推进产业扶贫,2017/06/05,6946,汪洋在全国农业产业扶贫经验交流会上强调树立正确政绩观扎实推进产业扶贫
中国社会扶贫网六省启动试点,2017/06/02,5300,中国社会扶贫网六省启动试点
2017年全国脱贫攻坚奖评选表彰活动正式启动,2017/06/02,4774,2017年全国脱贫攻坚奖评选表彰活动正式启动
汪洋：充分发挥考核评估推动作用促进提高脱贫攻坚工作质量,2017/06/02,3886,汪洋：充分发挥考核评估推动作用促进提高脱贫攻坚工作质量
云南省委书记陈豪：弘扬“西畴精神”抓实基层激发动力造福百姓,2017/06/01,3170,云南省委书记陈豪：弘扬“西畴精神”抓实基层激发动力造福百姓
【新闻联播】[砥砺奋进的五年·扶贫蹲点日记]山西武乡：魏宝玉卖米记,2017/06/01,2575,【新闻联播】[砥砺奋进的五年·扶贫蹲点日记]山西武乡：魏宝玉卖米记
湖南省省长许达哲：自觉履行党员义务全力参与脱贫攻坚,2017/05/31,3285,湖南省省长许达哲：自觉履行党员义务全力参与脱贫攻坚
刘永富在全国扶贫宣传工作会议上提出围绕迎接宣传贯彻十九大着力讲好扶贫故...,2017/05/24,7721,刘永富在全国扶贫宣传工作会议上提出围绕迎接宣传贯彻十九大着力讲好扶贫故事
孙春兰：统一战线要积极服务革命老区脱贫攻坚,2017/05/22,3831,孙春兰：统一战线要积极服务革命老区脱贫攻坚
这五年，习近平的扶贫足迹,2017/05/22,3539,这五年，习近平的扶贫足迹
庄严的承诺历史的跨越——党的十八大以来以习近平同志为核心的党中央引领脱...,2017/05/22,5067,庄严的承诺历史的跨越——党的十八大以来以习近平同志为核心的党中央引领脱贫攻坚纪实
倾情书写砥砺奋进的这五年,2017/05/19,3596,倾情书写砥砺奋进的这五年
杜青林在四川调研时强调脱贫攻坚要用实功、出实招、见实效,2017/05/17,3564,杜青林在四川调研时强调脱贫攻坚要用实功、出实招、见实效
刘永富主任应邀与中央党校第1期市地党政主要领导干部任职培训班学员座谈交流,2017/05/17,4493,刘永富主任应邀与中央党校第1期市地党政主要领导干部任职培训班学员座谈交流
汪洋在安徽调研扶贫工作时强调以产业发展促进稳定脱贫,2017/05/17,3984,汪洋在安徽调研扶贫工作时强调以产业发展促进稳定脱贫
国资委召开中央企业扶贫开发工作会议,2017/05/16,5380,国资委召开中央企业扶贫开发工作会议
杜青林：脱贫攻坚要用实功、出实招、见实效,2017/05/16,2853,杜青林：脱贫攻坚要用实功、出实招、见实效
县委书记扶贫不力检讨有哪些官员因扶贫被问责?,2017/05/15,6118,县委书记扶贫不力检讨有哪些官员因扶贫被问责?
黑龙江省委书记张庆伟：严肃认真开展脱贫攻坚回头看切实提升扶贫水平和脱贫...,2017/05/15,4229,黑龙江省委书记张庆伟：严肃认真开展脱贫攻坚回头看切实提升扶贫水平和脱贫质量
全国政协调研组在川开展扶贫监督性调研,2017/05/12,3742,全国政协调研组在川开展扶贫监督性调研
刘永富主任应邀赴中央直属机关党校作脱贫攻坚报告,2017/05/11,10646,刘永富主任应邀赴中央直属机关党校作脱贫攻坚报告
黑龙江省省委书记张庆伟聚焦打赢脱贫攻坚战三次到脱贫攻坚一线调研工作,2017/05/11,3554,黑龙江省省委书记张庆伟聚焦打赢脱贫攻坚战三次到脱贫攻坚一线调研工作
云南省委书记陈豪：把五级书记抓扶贫牢记于心贯彻于行,2017/05/10,9082,云南省委书记陈豪：把五级书记抓扶贫牢记于心贯彻于行
云南省委书记陈豪：在脱贫战场上锤炼干部作风把精准理念落细落小落实,2017/05/10,3793,云南省委书记陈豪：在脱贫战场上锤炼干部作风把精准理念落细落小落实
李纪恒：以解决问题为突破口把脱贫攻坚工作做得更实更好,2017/05/10,8721,李纪恒：以解决问题为突破口把脱贫攻坚工作做得更实更好
汪洋在山西出席易地扶贫搬迁工作推进会时强调坚持问题导向全面深入整改提升...,2017/05/09,3006,汪洋在山西出席易地扶贫搬迁工作推进会时强调坚持问题导向全面深入整改提升工作质量和成效
