标题,日期,阅读次数,正文
山西省省长李小鹏在扶贫联系点调研时强调：落实“四个切实”要求如期实现全...,2015/08/18,178,山西省省长李小鹏在扶贫联系点调研时强调：落实“四个切实”要求如期实现全面小康
汪洋在西藏调研时强调：抓好精准扶贫加快农牧区脱贫致富,2015/08/18,275,汪洋在西藏调研时强调：抓好精准扶贫加快农牧区脱贫致富
江西省省长鹿心社：打赢扶贫开发攻坚战（深入学习贯彻习近平同志系列重要讲话...,2015/08/17,228,江西省省长鹿心社：打赢扶贫开发攻坚战（深入学习贯彻习近平同志系列重要讲话精神）
云南省委书记李纪恒：责任上肩拧紧发条以“三严三实”作风推进扶贫攻坚,2015/08/17,224,云南省委书记李纪恒：责任上肩拧紧发条以“三严三实”作风推进扶贫攻坚
山西省长李小鹏在扶贫联系点调研时强调：落实“四个切实”要求如期实现全面...,2015/08/17,188,山西省长李小鹏在扶贫联系点调研时强调：落实“四个切实”要求如期实现全面小康
全面小康一个也不能少——论学习贯彻习近平总书记在吉林考察重要讲话精神,2015/08/11,236,全面小康一个也不能少——论学习贯彻习近平总书记在吉林考察重要讲话精神
云南省委副书记、省长陈豪在怒江调研强调：坚定不移打赢扶贫攻坚战,2015/08/10,295,云南省委副书记、省长陈豪在怒江调研强调：坚定不移打赢扶贫攻坚战
河南省委书记郭庚茂：站位全局分类施策打好精准扶贫攻坚战,2015/08/07,176,河南省委书记郭庚茂：站位全局分类施策打好精准扶贫攻坚战
[新闻联播]精准扶贫落实到户,2015/08/06,238,[新闻联播]精准扶贫落实到户
内蒙古自治区党委书记王君：深入学习贯彻习近平总书记重要讲话精神坚决打赢扶...,2015/08/05,230,内蒙古自治区党委书记王君：深入学习贯彻习近平总书记重要讲话精神坚决打赢扶贫攻坚这场硬仗
西藏自治区党委书记陈全国：以总书记重要讲话精神为指导推进扶贫开发确保全...,2015/08/05,205,西藏自治区党委书记陈全国：以总书记重要讲话精神为指导推进扶贫开发确保全区各族群众同步过上小康社会新生活
刘永富为扶贫培训班作辅导报告：全力打好精准扶贫攻坚战,2015/08/05,219,刘永富为扶贫培训班作辅导报告：全力打好精准扶贫攻坚战
刘永富主任与国务院扶贫办选派的贫困村第一书记座谈,2015/08/05,277,刘永富主任与国务院扶贫办选派的贫困村第一书记座谈
习近平提“精准扶贫”的内涵和意义是什么,2015/08/04,1126,习近平提“精准扶贫”的内涵和意义是什么
[新闻联播]我国打响扶贫开发攻坚战,2015/08/04,193,[新闻联播]我国打响扶贫开发攻坚战
杜家毫：心中装着群众加快扶贫攻坚,2015/08/04,242,杜家毫：心中装着群众加快扶贫攻坚
国务院扶贫办成立党建工作领导小组,2015/07/29,963,国务院扶贫办成立党建工作领导小组
第九届“中国-东盟社会发展与减贫论坛”在老挝万象开幕,2015/07/29,194,第九届“中国-东盟社会发展与减贫论坛”在老挝万象开幕
【新闻联播】精准扶贫四川彝区要拔掉“穷根”,2015/07/27,210,【新闻联播】精准扶贫四川彝区要拔掉“穷根”
各地加大力度扶贫攻坚确保农村贫困人口2020年脱贫,2015/07/26,214,各地加大力度扶贫攻坚确保农村贫困人口2020年脱贫
汪洋:坚持精准扶贫基本方略坚决完成脱贫攻坚任务,2015/07/25,336,汪洋:坚持精准扶贫基本方略坚决完成脱贫攻坚任务
农行与扶贫办携手推进扶贫金融创新,2015/07/24,248,农行与扶贫办携手推进扶贫金融创新
中央财政全年４６０．９亿元扶贫资金全部下拨,2015/07/22,351,中央财政全年４６０．９亿元扶贫资金全部下拨
刘永富：精准帮扶才能啃下“硬骨头”,2015/07/21,248,刘永富：精准帮扶才能啃下“硬骨头”
刘永富：互联网能够对社会扶贫发挥巨大作用,2015/07/21,158,刘永富：互联网能够对社会扶贫发挥巨大作用
刘永富：建立长效机制助贫困人口劳动致富,2015/07/21,229,刘永富：建立长效机制助贫困人口劳动致富
王国良：马铃薯是中国贫困地区产业开发的成功代表,2015/07/21,280,王国良：马铃薯是中国贫困地区产业开发的成功代表
中央下拨138.9亿元支持农村扶贫开发,2015/07/21,244,中央下拨138.9亿元支持农村扶贫开发
国务院扶贫办机关团委组织义务劳动,2015/07/17,113,国务院扶贫办机关团委组织义务劳动
国务院扶贫办党组中心组召开“三严三实”专题研讨会,2015/07/17,80,国务院扶贫办党组中心组召开“三严三实”专题研讨会
刘永富主持召开创新扶贫开发体制机制专题研究班学员座谈会,2015/07/17,105,刘永富主持召开创新扶贫开发体制机制专题研究班学员座谈会
安徽省委书记王学军强调：强化政治责任明确工作目标坚决打赢扶贫开发攻坚战,2015/07/16,186,安徽省委书记王学军强调：强化政治责任明确工作目标坚决打赢扶贫开发攻坚战
湖南省委副书记、省长杜家毫:践行“三严三实”打好扶贫开发攻坚战,2015/07/16,163,湖南省委副书记、省长杜家毫:践行“三严三实”打好扶贫开发攻坚战
国务院扶贫办创新扶贫开发体制机制专题研究班在国家行政学院举办,2015/07/15,146,国务院扶贫办创新扶贫开发体制机制专题研究班在国家行政学院举办
辽宁省省长陈求发到锦州义县调研扶贫开发工作,2015/07/14,266,辽宁省省长陈求发到锦州义县调研扶贫开发工作
辽宁省委书记、省人大常委会主任李希到彰武县调研并主持召开全省扶贫开发座谈...,2015/07/14,97,辽宁省委书记、省人大常委会主任李希到彰武县调研并主持召开全省扶贫开发座谈会
甘肃集中资源精准扶贫,2015/07/14,259,甘肃集中资源精准扶贫
刘永富走访经济日报社,2015/07/14,320,刘永富走访经济日报社
[新闻联播]甘肃：建档立卡靶向治疗,2015/07/13,185,[新闻联播]甘肃：建档立卡靶向治疗
加大教育扶贫力度推动医改落地生根,2015/07/13,277,加大教育扶贫力度推动医改落地生根
[新闻联播]四川：双轮驱动扶贫攻坚,2015/07/10,117,[新闻联播]四川：双轮驱动扶贫攻坚
洪天云走访中央统战部,2015/07/10,34,洪天云走访中央统战部
我办干部职工积极踊跃参加中央国家机关第四届职工运动会,2015/07/09,229,我办干部职工积极踊跃参加中央国家机关第四届职工运动会
六盘山片区陕甘宁青四省（区）政协主席联席会议召开,2015/07/09,233,六盘山片区陕甘宁青四省（区）政协主席联席会议召开
全国雨露计划职业教育培训工作会议在京召开,2015/07/09,298,全国雨露计划职业教育培训工作会议在京召开
［人民日报］形势不等人扶贫咋冲刺（四个切实怎样落实(下)）,2015/07/07,286,［人民日报］形势不等人扶贫咋冲刺（四个切实怎样落实(下)）
［人民日报］精准扶贫的更大功夫怎么下（四个切实怎样落实(上)）,2015/07/06,726,［人民日报］精准扶贫的更大功夫怎么下（四个切实怎样落实(上)）
娄勤俭在永寿县调研扶贫工作时强调转变扶贫方式用足用活政策推动精准扶贫不...,2015/07/03,213,娄勤俭在永寿县调研扶贫工作时强调转变扶贫方式用足用活政策推动精准扶贫不断实现新突破
中央第二巡视组专项巡视国务院扶贫开发领导小组办公室工作动员会召开,2015/07/02,211,中央第二巡视组专项巡视国务院扶贫开发领导小组办公室工作动员会召开
洪天云会见柬埔寨人民党地方党委书记考察团,2015/07/02,198,洪天云会见柬埔寨人民党地方党委书记考察团
全国旅游扶贫工程现场会在四川召开,2015/10/13,216,全国旅游扶贫工程现场会在四川召开
人民网专访国务院扶贫办主任刘永富,2015/07/02,244,人民网专访国务院扶贫办主任刘永富
国务院扶贫办召开纪念建党94周年暨“两优一先”表彰大会,2015/07/01,190,国务院扶贫办召开纪念建党94周年暨“两优一先”表彰大会
刘永富主任在国务院扶贫办纪念建党94周年暨＂两优一先＂表彰大会上的讲话,2015/07/01,286,刘永富主任在国务院扶贫办纪念建党94周年暨＂两优一先＂表彰大会上的讲话
刘主任在第四届全球智库峰会综合论坛一上的发言,2015/06/29,91,刘主任在第四届全球智库峰会综合论坛一上的发言
刘永富出席生态文明与开发式扶贫论坛并主旨演讲全文,2015/06/29,278,刘永富出席生态文明与开发式扶贫论坛并主旨演讲全文
刘永富出席生态文明与开放式扶贫论坛并主旨演讲,2015/06/29,153,刘永富出席生态文明与开放式扶贫论坛并主旨演讲
刘永富：深入实施精准扶贫战略全面建成小康社会,2015/06/29,177,刘永富：深入实施精准扶贫战略全面建成小康社会
刘永富：必须把解决穷人的问题作为重要任务,2015/06/28,190,刘永富：必须把解决穷人的问题作为重要任务
刘永富主任出席云南扶贫开发工作会议并调研,2015/06/26,185,刘永富主任出席云南扶贫开发工作会议并调研
扶贫办主任座谈会在北京召开,2015/06/26,781,扶贫办主任座谈会在北京召开
王学军深入泗县调研扶贫开发工作,2015/06/25,206,王学军深入泗县调研扶贫开发工作
国务院扶贫办主任刘永富:精准扶贫要在十方面下功夫,2015/06/25,504,国务院扶贫办主任刘永富:精准扶贫要在十方面下功夫
国务院扶贫办主任：让有限资源更精准指向贫困群众,2015/06/25,217,国务院扶贫办主任：让有限资源更精准指向贫困群众
[人民日报]补好扶贫开发这块短板——一论谋划好“十三五”时期扶贫开发工作,2015/06/25,255,[人民日报]补好扶贫开发这块短板——一论谋划好“十三五”时期扶贫开发工作
洪天云走访中央国家机关工委,2015/06/25,176,洪天云走访中央国家机关工委
[新华网]以超常手段“攻坚拔寨”——来自扶贫攻坚现场的调查报告,2015/06/24,362,[新华网]以超常手段“攻坚拔寨”——来自扶贫攻坚现场的调查报告
刘永富李纪恒率队在云南会泽县调研扶贫工作时强调用心用情用力扶贫一任接着...,2015/06/24,232,刘永富李纪恒率队在云南会泽县调研扶贫工作时强调用心用情用力扶贫一任接着一任攻坚
四川省委召开常委会议传达学习部分省区市党委主要负责同志座谈会精神,2015/06/24,285,四川省委召开常委会议传达学习部分省区市党委主要负责同志座谈会精神
国际农业发展基金贷款青海省六盘山片区扶贫项目资金申请报告获国家批复,2015/06/24,219,国际农业发展基金贷款青海省六盘山片区扶贫项目资金申请报告获国家批复
国务院扶贫办主任：中国贫困地区面临五大突出问题,2015/06/24,1233,国务院扶贫办主任：中国贫困地区面临五大突出问题
洪天云走访中直机关工委,2015/06/23,270,洪天云走访中直机关工委
勠力同心打赢扶贫攻坚这场硬仗,2015/06/23,160,勠力同心打赢扶贫攻坚这场硬仗
“中国式扶贫”面临历史大考,2015/06/23,537,“中国式扶贫”面临历史大考
新华社评论员:跑好脱贫冲刺期打赢扶贫攻坚战,2015/06/23,150,新华社评论员:跑好脱贫冲刺期打赢扶贫攻坚战
全国政协调研扶贫新挑战打赢扶贫攻坚这场硬仗,2015/06/23,282,全国政协调研扶贫新挑战打赢扶贫攻坚这场硬仗
江苏：凝聚五方合力主攻六大片区,2015/06/22,246,江苏：凝聚五方合力主攻六大片区
云南全面推进扶贫攻坚各项工作确保贫困人口到2020年如期全部脱贫,2015/06/21,219,云南全面推进扶贫攻坚各项工作确保贫困人口到2020年如期全部脱贫
国土资源部：依托行业优势加快贫困地区脱贫致富,2015/06/21,508,国土资源部：依托行业优势加快贫困地区脱贫致富
交通运输部全力推进交通扶贫不让脱贫卡在路上,2015/06/20,292,交通运输部全力推进交通扶贫不让脱贫卡在路上
广西壮族自治区党委书记彭清华赴贵州出席部分省区市党委主要负责同志座谈会并...,2015/06/20,176,广西壮族自治区党委书记彭清华赴贵州出席部分省区市党委主要负责同志座谈会并考察扶贫开发工作
湖南省委书记徐守盛在贵州省毕节市考察扶贫工作,2015/06/20,191,湖南省委书记徐守盛在贵州省毕节市考察扶贫工作
新华时评：精准到位的扶贫群众才会真心点赞,2015/06/20,214,新华时评：精准到位的扶贫群众才会真心点赞
[新闻联播]习近平在贵州调研时关注扶贫工作,2015/06/19,411,[新闻联播]习近平在贵州调研时关注扶贫工作
安徽省政府在金寨县召开大别山片区扶贫攻坚与区域发展座谈会,2015/06/19,62,安徽省政府在金寨县召开大别山片区扶贫攻坚与区域发展座谈会
《人民日报》：精准扶贫“滴灌”到户,2015/06/19,617,《人民日报》：精准扶贫“滴灌”到户
《人民日报》：行业扶贫加力攻坚,2015/06/19,255,《人民日报》：行业扶贫加力攻坚
洪天云主持召开定点扶贫结对关系调整工作座谈会,2015/06/17,542,洪天云主持召开定点扶贫结对关系调整工作座谈会
九三学社中央调研宁夏六盘山扶贫开发工作,2015/06/17,192,九三学社中央调研宁夏六盘山扶贫开发工作
湖北省委书记李鸿忠主持召开专题座谈会就精准扶贫听取基层意见建议,2015/06/17,218,湖北省委书记李鸿忠主持召开专题座谈会就精准扶贫听取基层意见建议
湖北省省长王国生到阳新县调研扶贫工作,2015/06/17,251,湖北省省长王国生到阳新县调研扶贫工作
安徽省代省长李锦斌调研大别山片区扶贫开发工作,2015/06/17,207,安徽省代省长李锦斌调研大别山片区扶贫开发工作
习近平考察贵州：政策好不好要看乡亲们是哭还是笑,2015/06/17,260,习近平考察贵州：政策好不好要看乡亲们是哭还是笑
欧青平率国务院扶贫办督导组对青海、甘肃两省涉农资金专项整治行动进行督导,2015/06/15,191,欧青平率国务院扶贫办督导组对青海、甘肃两省涉农资金专项整治行动进行督导
大连市党政代表团赴贵州省六盘水市深入推进对口帮扶工作,2015/06/15,355,大连市党政代表团赴贵州省六盘水市深入推进对口帮扶工作
［人民日报］赣州关注民生精准扶贫（助力老区扶贫）,2015/06/15,260,［人民日报］赣州关注民生精准扶贫（助力老区扶贫）
完善金融服务创新扶贫机制国务院扶贫办和中国邮政储蓄银行签署金融扶贫合作...,2015/06/12,227,完善金融服务创新扶贫机制国务院扶贫办和中国邮政储蓄银行签署金融扶贫合作战略协议
国务院扶贫办召开中央主要新闻媒体座谈会,2015/06/11,194,国务院扶贫办召开中央主要新闻媒体座谈会
内蒙古前5个月新增金融扶贫贷款33.75亿元,2015/06/11,487,内蒙古前5个月新增金融扶贫贷款33.75亿元
翁牛特旗落实总理指示“五个模式”推进精准扶贫,2015/06/11,185,翁牛特旗落实总理指示“五个模式”推进精准扶贫
江苏省省长李学勇赴贵州考察对口帮扶工作,2015/06/11,253,江苏省省长李学勇赴贵州考察对口帮扶工作
国务院扶贫办党员干部参观中央国家机关反腐倡廉警示教育基地,2015/06/10,218,国务院扶贫办党员干部参观中央国家机关反腐倡廉警示教育基地
刘永富到内蒙古自治区调研扶贫工作,2015/06/09,250,刘永富到内蒙古自治区调研扶贫工作
郑文凯主持召开专题调研会,2015/06/08,279,郑文凯主持召开专题调研会
湖北省委书记李鸿忠主持召开省委常委会会议专题研究扶贫开发工作,2015/06/08,170,湖北省委书记李鸿忠主持召开省委常委会会议专题研究扶贫开发工作
刘永富会见农发行解学智董事长祝树民行长一行,2015/06/05,240,刘永富会见农发行解学智董事长祝树民行长一行
洪天云主持召开东西扶贫协作工作座谈会,2015/06/05,32,洪天云主持召开东西扶贫协作工作座谈会
"""全国扶贫第一村""所在地脱贫调查：思想意识不贫困",2015/06/05,346,"""全国扶贫第一村""所在地脱贫调查：思想意识不贫困"
关于加强雨露计划支持农村贫困家庭新成长劳动力接受职业教育的意见,2015/06/05,3469,关于加强雨露计划支持农村贫困家庭新成长劳动力接受职业教育的意见
甘肃省省长刘伟平主持召开省政府常务会议研究确定鼓励社会力量参与扶贫开发措...,2015/06/05,204,甘肃省省长刘伟平主持召开省政府常务会议研究确定鼓励社会力量参与扶贫开发措施
精准扶贫不能玩“数字游戏”,2015/06/05,516,精准扶贫不能玩“数字游戏”
欧青平主持召开“十三五”整村推进工作座谈会,2015/06/04,45,欧青平主持召开“十三五”整村推进工作座谈会
洪天云为扶贫高级人才培养工程2014级公共管理硕士研究生班授课,2015/06/04,272,洪天云为扶贫高级人才培养工程2014级公共管理硕士研究生班授课
“十三五”扶贫规划专题研讨会在京召开,2015/06/03,127,“十三五”扶贫规划专题研讨会在京召开
广东省省长朱小丹到清远市调研扶贫“双到”工作,2015/06/03,250,广东省省长朱小丹到清远市调研扶贫“双到”工作
一位挂职干部在兰考扶贫的“三悟”,2015/06/02,430,一位挂职干部在兰考扶贫的“三悟”
甘肃省长刘伟平在通渭县调研精准扶贫精准脱贫工作,2015/06/01,184,甘肃省长刘伟平在通渭县调研精准扶贫精准脱贫工作
人民日报：绝不能以穷为荣、以穷为由（声音）,2015/06/01,557,人民日报：绝不能以穷为荣、以穷为由（声音）
洪天云走访全国工商联,2015/05/29,200,洪天云走访全国工商联
"习近平:抓住机遇立足优势积极作为系统谋划""十三五""经济社会发展",2015/05/29,173,"习近平:抓住机遇立足优势积极作为系统谋划""十三五""经济社会发展"
欧青平为创新扶贫开发体制机制专题研究班授课,2015/05/28,38,欧青平为创新扶贫开发体制机制专题研究班授课
洪天云为创新扶贫开发体制机制专题研究班授课,2015/05/28,191,洪天云为创新扶贫开发体制机制专题研究班授课
刘永富为创新扶贫开发体制机制专题研究班授课,2015/05/28,319,刘永富为创新扶贫开发体制机制专题研究班授课
洪天云参加工业和信息化部2015年扶贫工作会议,2015/05/28,136,洪天云参加工业和信息化部2015年扶贫工作会议
刘永富：从“严”要求落到“实”处，全力打造高素质扶贫干部队伍,2015/05/26,154,刘永富：从“严”要求落到“实”处，全力打造高素质扶贫干部队伍
辽宁省委书记李希到扶贫联系点视察,2015/05/26,283,辽宁省委书记李希到扶贫联系点视察
扶贫办党组理论学习中心组举办学习习近平总书记关于扶贫开发重要论述专题讲座,2015/05/26,517,扶贫办党组理论学习中心组举办学习习近平总书记关于扶贫开发重要论述专题讲座
湖北省委常委会传达学习汪洋副总理在湖北省恩施调研扶贫开发工作时的重要讲话...,2015/05/25,195,湖北省委常委会传达学习汪洋副总理在湖北省恩施调研扶贫开发工作时的重要讲话精神
国务院扶贫办：电商扶贫拓宽贫困农户增收渠道,2015/05/23,621,国务院扶贫办：电商扶贫拓宽贫困农户增收渠道
李克强总理访问拉美四国,2015/05/22,2015-05-22,李克强总理访问拉美四国
全国贫困村创业致富带头人培训闽甘、闽宁试点第三期培训班在福建南安开班,2015/05/22,328,全国贫困村创业致富带头人培训闽甘、闽宁试点第三期培训班在福建南安开班
甘肃省长刘伟平：紧扣贫困群众所盼所需使扶贫政策更“接地气”,2015/05/22,260,甘肃省长刘伟平：紧扣贫困群众所盼所需使扶贫政策更“接地气”
甘肃省委副书记、省长刘伟平:精准把脉对症下药科学施策推动甘肃扶贫攻坚取...,2015/05/21,232,甘肃省委副书记、省长刘伟平:精准把脉对症下药科学施策推动甘肃扶贫攻坚取得实效
江苏省委书记罗志军主持召开加快脱贫致富奔小康座谈会,2015/05/20,57,江苏省委书记罗志军主持召开加快脱贫致富奔小康座谈会
四川省委召开常委会议听取全省国资国企改革工作和全省扶贫开发工作督查调研...,2015/05/20,139,四川省委召开常委会议听取全省国资国企改革工作和全省扶贫开发工作督查调研情况汇报
汪洋在湖北调研旅游扶贫工作时强调大力发展乡村旅游扶贫促进贫困群众脱贫致...,2015/05/20,215,汪洋在湖北调研旅游扶贫工作时强调大力发展乡村旅游扶贫促进贫困群众脱贫致富
刘永富主任带队到重庆调研指导工作,2015/05/18,229,刘永富主任带队到重庆调研指导工作
"万鄂湘赴河北调研扶贫工作与贫困户""结亲戚""",2015/05/18,209,"万鄂湘赴河北调研扶贫工作与贫困户""结亲戚"""
民革：以智扶贫，乌蒙焕新颜,2015/05/18,263,民革：以智扶贫，乌蒙焕新颜
黑龙江省政协主席杜宇新深入特困片区调研扶贫工作,2015/05/14,239,黑龙江省政协主席杜宇新深入特困片区调研扶贫工作
刘永富主任会见广西壮族自治区百色市市长周异决一行,2015/05/14,251,刘永富主任会见广西壮族自治区百色市市长周异决一行
扶贫宣传工作座谈会在京召开,2015/05/14,445,扶贫宣传工作座谈会在京召开
“旅游扶贫？行业协会在行动”启动仪式在京举行,2015/05/13,226,“旅游扶贫？行业协会在行动”启动仪式在京举行
刘永富会见西藏自治区政府副主席坚参一行,2015/05/12,242,刘永富会见西藏自治区政府副主席坚参一行
郑文凯在昔阳调研扶贫开发工作情况,2015/05/11,216,郑文凯在昔阳调研扶贫开发工作情况
刘永富主任会见国管局房地产管理司司长赵峰涛一行,2015/05/11,3213,刘永富主任会见国管局房地产管理司司长赵峰涛一行
汪洋考察贵州扶贫开发工作扶贫攻坚进入关键阶段深化扶贫脱贫更加精准,2015/05/11,382,汪洋考察贵州扶贫开发工作扶贫攻坚进入关键阶段深化扶贫脱贫更加精准
郑文凯副主任赴河北、山西调研,2015/05/11,271,郑文凯副主任赴河北、山西调研
国务院扶贫办主任刘永富赴贵州省榕江县调研,2015/05/11,262,国务院扶贫办主任刘永富赴贵州省榕江县调研
欧青平参加幸福工程20周年纪念大会,2015/05/11,162,欧青平参加幸福工程20周年纪念大会
国务院扶贫办开展干部职工健步走活动,2015/05/08,163,国务院扶贫办开展干部职工健步走活动
国务院扶贫办组织开展义务劳动,2015/05/08,255,国务院扶贫办组织开展义务劳动
首届大学生假期返乡调研成果表彰暨新常态下扶贫对策研讨会在京召开,2015/05/07,484,首届大学生假期返乡调研成果表彰暨新常态下扶贫对策研讨会在京召开
国务院扶贫办召开“三严三实”专题教育动员部署会,2015/05/06,138,国务院扶贫办召开“三严三实”专题教育动员部署会
国务院扶贫办召开“五四”青年干部座谈会,2015/05/06,223,国务院扶贫办召开“五四”青年干部座谈会
刘永富主任会见山西省郭迎光副省长,2015/05/06,230,刘永富主任会见山西省郭迎光副省长
人民日报：亚行将启动改革提高扶贫贷款能力,2015/05/05,175,人民日报：亚行将启动改革提高扶贫贷款能力
江西省委书记强卫：确保老区人民与全国人民一起进入全面小康社会,2015/05/05,246,江西省委书记强卫：确保老区人民与全国人民一起进入全面小康社会
人民日报：四川把扶贫解困作为新村建设首要任务,2015/05/05,191,人民日报：四川把扶贫解困作为新村建设首要任务
信息中心召开扶贫开发大数据应用分析座谈会,2015/05/05,234,信息中心召开扶贫开发大数据应用分析座谈会
刘永富主任与国家开发银行袁力副行长会商开发性金融精准扶贫工作,2015/04/30,484,刘永富主任与国家开发银行袁力副行长会商开发性金融精准扶贫工作
郑文凯参加中央国家机关和有关单位定点扶贫云南座谈会,2015/04/30,197,郑文凯参加中央国家机关和有关单位定点扶贫云南座谈会
四川省委书记王东明：把精准扶贫各项措施落实到户落实到人,2015/04/30,236,四川省委书记王东明：把精准扶贫各项措施落实到户落实到人
欧青平副主任到国家电网公司走访,2015/04/30,279,欧青平副主任到国家电网公司走访
