标题,日期,阅读次数,正文
湖北省委书记应勇：确保如期完成湖北脱贫攻坚目标任务疫情防控一丝也不能放...,2020/03/08,3914,湖北省委书记应勇：确保如期完成湖北脱贫攻坚目标任务疫情防控一丝也不能放松，脱贫攻坚一天也不能耽搁!
凝心聚力坚决夺取脱贫攻坚战全面胜利——习近平总书记在决战决胜脱贫攻坚座...,2020/03/08,4901,凝心聚力坚决夺取脱贫攻坚战全面胜利——习近平总书记在决战决胜脱贫攻坚座谈会上的重要讲话在各地引发强烈反响
西藏自治区党委书记吴英杰：决战决胜脱贫攻坚，收官之年这么干！,2020/03/08,4502,西藏自治区党委书记吴英杰：决战决胜脱贫攻坚，收官之年这么干！
人民日报评论员：坚决夺取脱贫攻坚战全面胜利——论学习贯彻习近平总书记在决...,2020/03/08,4896,人民日报评论员：坚决夺取脱贫攻坚战全面胜利——论学习贯彻习近平总书记在决战决胜脱贫攻坚座谈会上重要讲话
越到最后越要紧绷这根弦——习近平总书记在决战决胜脱贫攻坚座谈会上重要讲话...,2020/03/08,4530,越到最后越要紧绷这根弦——习近平总书记在决战决胜脱贫攻坚座谈会上重要讲话引发强烈反响
湖南省委召开会议学习贯彻决战决胜脱贫攻坚座谈会精神聚焦短板弱项精准施策...,2020/03/07,4126,湖南省委召开会议学习贯彻决战决胜脱贫攻坚座谈会精神聚焦短板弱项精准施策全力攻坚确保如期高质量完成脱贫攻坚目标任务
新华社评论员：坚决克服疫情影响，坚决夺取脱贫胜利——学习贯彻习近平总书记...,2020/03/07,4120,新华社评论员：坚决克服疫情影响，坚决夺取脱贫胜利——学习贯彻习近平总书记在决战决胜脱贫攻坚座谈会重要讲话
重庆市委常委会召开扩大会议学习贯彻决战决胜脱贫攻坚座谈会精神统筹抓好...,2020/03/07,3909,重庆市委常委会召开扩大会议学习贯彻决战决胜脱贫攻坚座谈会精神统筹抓好“战疫”与“战贫”坚决如期高质量打赢脱贫攻坚战
云南省召开电视电话会议学习贯彻决战决胜脱贫攻坚座谈会精神坚决夺取战“...,2020/03/07,3910,云南省召开电视电话会议学习贯彻决战决胜脱贫攻坚座谈会精神坚决夺取战“疫”战“贫”两场硬仗全面胜利
河南省召开决战决胜脱贫攻坚电视电话会议以习近平总书记重要讲话精神为指导...,2020/03/07,4765,河南省召开决战决胜脱贫攻坚电视电话会议以习近平总书记重要讲话精神为指导凝心聚力坚决打赢脱贫攻坚收官之战
习近平：在决战决胜脱贫攻坚座谈会上的讲话,2020/03/06,68037,习近平：在决战决胜脱贫攻坚座谈会上的讲话
习近平：坚决克服新冠肺炎疫情影响坚决夺取脱贫攻坚战全面胜利,2020/03/06,10258,习近平：坚决克服新冠肺炎疫情影响坚决夺取脱贫攻坚战全面胜利
积极应对疫情稳步推进脱贫攻坚工作,2020/03/06,4534,积极应对疫情稳步推进脱贫攻坚工作
我国10个省区市的贫困县脱贫摘帽,2020/03/06,4295,我国10个省区市的贫困县脱贫摘帽
山西省脱贫攻坚问题排查整改暨挂牌督战工作部署会召开,2020/03/04,3926,山西省脱贫攻坚问题排查整改暨挂牌督战工作部署会召开
贵州省委书记孙志刚视频督战“9+3”县（区）脱贫攻坚并调度疫情防控工作,2020/03/04,5126,贵州省委书记孙志刚视频督战“9+3”县（区）脱贫攻坚并调度疫情防控工作
如何统筹推进疫情防控和脱贫攻坚工作？国家发展改革委作出六个方面部署,2020/03/03,5785,如何统筹推进疫情防控和脱贫攻坚工作？国家发展改革委作出六个方面部署
国家发展改革委等13部委：出台25项易地扶贫搬迁后续扶持政策措施,2020/03/03,7724,国家发展改革委等13部委：出台25项易地扶贫搬迁后续扶持政策措施
脱贫攻坚，瞄准目标再发力,2020/03/02,5303,脱贫攻坚，瞄准目标再发力
众志成城同舟共济扶贫办全体干部职工积极踊跃向疫区捐款,2020/03/02,4763,众志成城同舟共济扶贫办全体干部职工积极踊跃向疫区捐款
云南省委书记陈豪率队到昭通、曲靖检查指导工作：坚决打赢疫情防控阻击战和脱...,2020/03/02,3616,云南省委书记陈豪率队到昭通、曲靖检查指导工作：坚决打赢疫情防控阻击战和脱贫攻坚战！
宁夏回族自治区扶贫开发领导小组会议暨全区脱贫攻坚“四查四补”工作会议召开...,2020/03/02,4106,宁夏回族自治区扶贫开发领导小组会议暨全区脱贫攻坚“四查四补”工作会议召开坚决克服疫情影响全面开展“四查四补”如期全面完成脱贫攻坚任务
吉林省委书记巴音朝鲁出席脱贫攻坚领导小组第3次（扩大）会议,2020/03/02,3854,吉林省委书记巴音朝鲁出席脱贫攻坚领导小组第3次（扩大）会议
全国又有8个省市贫困县全部脱贫摘帽,2020/03/02,5277,全国又有8个省市贫困县全部脱贫摘帽
胡春华：努力克服疫情影响确保实现决战脱贫攻坚目标任务,2020/02/27,7087,胡春华：努力克服疫情影响确保实现决战脱贫攻坚目标任务
全国扶贫办主任电视电话会议强调坚定必胜信心坚决完成脱贫攻坚任务,2020/02/26,8159,全国扶贫办主任电视电话会议强调坚定必胜信心坚决完成脱贫攻坚任务
国务院扶贫办印发通知要求积极应对新冠肺炎疫情影响切实做好驻村帮扶工作,2020/02/26,7925,国务院扶贫办印发通知要求积极应对新冠肺炎疫情影响切实做好驻村帮扶工作
宁夏回族自治区党委书记陈润儿在自治区扶贫办调研并召开座谈会：清醒认识疫情...,2020/02/26,3813,宁夏回族自治区党委书记陈润儿在自治区扶贫办调研并召开座谈会：清醒认识疫情带来的不利影响坚决实现脱贫攻坚的圆满收官
人力资源社会保障部国务院扶贫办关于应对新冠肺炎疫情进一步做好就业扶贫工...,2020/02/24,5571,人力资源社会保障部国务院扶贫办关于应对新冠肺炎疫情进一步做好就业扶贫工作的通知
战疫情、促增收，就业扶贫在发力,2020/02/24,5938,战疫情、促增收，就业扶贫在发力
农业农村部办公厅、国务院扶贫办综合司：全力应对疫情对产业扶贫影响,2020/02/22,5735,农业农村部办公厅、国务院扶贫办综合司：全力应对疫情对产业扶贫影响
国务院扶贫办主管社团积极应对新冠肺炎疫情,2020/02/21,4079,国务院扶贫办主管社团积极应对新冠肺炎疫情
胡和平在陕西省脱贫攻坚领导小组会议上强调努力克服疫情影响坚决打赢脱贫...,2020/02/21,1017,胡和平在陕西省脱贫攻坚领导小组会议上强调努力克服疫情影响坚决打赢脱贫攻坚这场硬仗
胡和平在全省加强农村疫情防控决战决胜脱贫攻坚视频会议上强调加强农村疫情...,2020/02/19,3831,胡和平在全省加强农村疫情防控决战决胜脱贫攻坚视频会议上强调加强农村疫情防控决胜全面小康决战脱贫攻坚夺取疫情防控和实现经济社会发展目标
两部门：切实保障资金需要确保全面如期完成脱贫攻坚任务,2020/02/19,4942,两部门：切实保障资金需要确保全面如期完成脱贫攻坚任务
汪洋在脱贫攻坚民主监督工作座谈会上强调疫情防控要抓紧脱贫攻坚不放松,2020/02/18,6578,汪洋在脱贫攻坚民主监督工作座谈会上强调疫情防控要抓紧脱贫攻坚不放松
七部门联合开展消费扶贫行动助力打赢脱贫攻坚战,2020/02/18,6891,七部门联合开展消费扶贫行动助力打赢脱贫攻坚战
国务院扶贫开发领导小组印发关于开展挂牌督战工作的指导意见的通知,2020/02/18,6039,国务院扶贫开发领导小组印发关于开展挂牌督战工作的指导意见的通知
国务院扶贫办：做好疫情防控期间脱贫攻坚工作,2020/02/17,9016,国务院扶贫办：做好疫情防控期间脱贫攻坚工作
王国生在省扶贫办调研时强调坚定信心不动摇分类施策巧安排打赢疫情防控...,2020/02/17,3519,王国生在省扶贫办调研时强调坚定信心不动摇分类施策巧安排打赢疫情防控和脱贫攻坚两场硬仗
鹿心社主持召开自治区扶贫开发领导小组会议,2020/02/17,4153,鹿心社主持召开自治区扶贫开发领导小组会议
战疫情·国务院扶贫办做好疫情防控期间的脱贫攻坚工作,2020/02/16,6680,战疫情·国务院扶贫办做好疫情防控期间的脱贫攻坚工作
国务院扶贫办召开全国扶贫办主任电视电话会议,2020/02/14,11665,国务院扶贫办召开全国扶贫办主任电视电话会议
国务院扶贫办中央网信办教育部农业农村部商务部国务院国资委全国...,2020/02/14,8326,国务院扶贫办中央网信办教育部农业农村部商务部国务院国资委全国工商联关于开展消费扶贫行动的通知
国务院扶贫开发领导小组关于做好新冠肺炎疫情防控期间脱贫攻坚工作的通知,2020/02/13,11772,国务院扶贫开发领导小组关于做好新冠肺炎疫情防控期间脱贫攻坚工作的通知
国务院扶贫办中国银保监会印发《关于积极应对新冠肺炎疫情影响切实做好扶贫...,2020/02/12,3215,国务院扶贫办中国银保监会印发《关于积极应对新冠肺炎疫情影响切实做好扶贫小额信贷工作的通知》
我国对脱贫攻坚挂牌督战确保贫困人口如期脱贫,2020/02/08,21629,我国对脱贫攻坚挂牌督战确保贫困人口如期脱贫
中国扶贫研究院院长汪三贵：聚焦两类人群加大攻坚力度,2020/02/07,3981,中国扶贫研究院院长汪三贵：聚焦两类人群加大攻坚力度
扶贫系统积极妥善部署疫情防控和脱贫攻坚工作,2020/02/06,6108,扶贫系统积极妥善部署疫情防控和脱贫攻坚工作
中共中央国务院关于抓好“三农”领域重点工作确保如期实现全面小康的意见,2020/02/05,6833,中共中央国务院关于抓好“三农”领域重点工作确保如期实现全面小康的意见
2020年中央一号文件公布提出两大重点任务,2020/02/05,7272,2020年中央一号文件公布提出两大重点任务
刘永富同志检查疫情防控后勤保障工作,2020/02/02,983,刘永富同志检查疫情防控后勤保障工作
关于做好新型冠状病毒感染肺炎疫情防控和脱贫攻坚有关工作的通知,2020/01/31,7146,关于做好新型冠状病毒感染肺炎疫情防控和脱贫攻坚有关工作的通知
李克强在青海考察,2020/01/23,4186,李克强在青海考察
李克强在青海这个村祝福大家：稳稳当当走向富裕不再返贫,2020/01/22,3816,李克强在青海这个村祝福大家：稳稳当当走向富裕不再返贫
全区扶贫开发工作会议召开石泰峰布小林作出批示,2020/01/22,4051,全区扶贫开发工作会议召开石泰峰布小林作出批示
【河北】王东峰到保定市阜平县调研慰问,2020/01/22,483,【河北】王东峰到保定市阜平县调研慰问
团中央召开扶贫工作领导小组2020年第一次会议,2020/01/22,4123,团中央召开扶贫工作领导小组2020年第一次会议
“送万福、进万家”书法公益活动走进国务院扶贫办,2020/01/21,4241,“送万福、进万家”书法公益活动走进国务院扶贫办
杜家毫在省第十一届纪委第五次全体会议上强调以全面从严治党新成效推进治理体...,2020/01/21,4063,杜家毫在省第十一届纪委第五次全体会议上强调以全面从严治党新成效推进治理体系和治理能力现代化为决胜全面建成小康社会决战脱贫攻坚
林铎在省委统一战线工作领导小组会议上强调加强思想政治引领充分发挥优势作...,2020/01/21,3702,林铎在省委统一战线工作领导小组会议上强调加强思想政治引领充分发挥优势作用为决胜全面小康决战脱贫攻坚凝聚力量
陈敏尔：坚定不移推进全面从严治党为决胜全面小康决战脱贫攻坚提供坚强保障,2020/01/21,4225,陈敏尔：坚定不移推进全面从严治党为决胜全面小康决战脱贫攻坚提供坚强保障
夏更生出席2020年全国文化科技卫生“三下乡”集中示范活动并在内蒙古赤峰...,2020/01/21,3507,夏更生出席2020年全国文化科技卫生“三下乡”集中示范活动并在内蒙古赤峰市调研
李克强主持召开国务院常务会议,2020/01/21,4062,李克强主持召开国务院常务会议
国务院扶贫办召开退休老干部新春座谈会,2020/01/20,3503,国务院扶贫办召开退休老干部新春座谈会
国务院扶贫办召开2019年度机关党建工作述职评议考核会议,2020/01/20,5059,国务院扶贫办召开2019年度机关党建工作述职评议考核会议
胡春华在广西百色调研督导脱贫攻坚工作,2020/01/19,4192,胡春华在广西百色调研督导脱贫攻坚工作
国家发展改革委等三部门联合印发通知推动贫困县在整合使用涉农资金时大力推广...,2020/01/19,3297,国家发展改革委等三部门联合印发通知推动贫困县在整合使用涉农资金时大力推广以工代赈方式
刘永富主任会见重庆市委副书记、市长唐良智一行,2020/01/16,4239,刘永富主任会见重庆市委副书记、市长唐良智一行
打赢精准脱贫攻坚战，天津市政府工作报告确定收官之年任务,2020/01/15,4061,打赢精准脱贫攻坚战，天津市政府工作报告确定收官之年任务
蒋超良参加随州咸宁代表团审议时提出确保脱贫攻坚成色更足质量更高,2020/01/15,4104,蒋超良参加随州咸宁代表团审议时提出确保脱贫攻坚成色更足质量更高
全面从严治党，习近平强调今年尤其要聚焦这件大事,2020/01/15,4639,全面从严治党，习近平强调今年尤其要聚焦这件大事
陈敏尔在参加黔江代表团审议时强调决胜全面小康决战脱贫攻坚推动高质量发...,2020/01/15,3406,陈敏尔在参加黔江代表团审议时强调决胜全面小康决战脱贫攻坚推动高质量发展之路越走越宽广
习近平在十九届中央纪委四次全会上发表重要讲话,2020/01/14,4605,习近平在十九届中央纪委四次全会上发表重要讲话
青海省扶贫开发工作会议在西宁召开,2020/01/14,4461,青海省扶贫开发工作会议在西宁召开
保持永不懈怠精神状态和一往无前奋斗姿态确保全面打赢脱贫攻坚战全面建成小...,2020/01/13,5694,保持永不懈怠精神状态和一往无前奋斗姿态确保全面打赢脱贫攻坚战全面建成小康社会
刘永富主任会见北京市委常委、副市长殷勇一行,2020/01/10,4072,刘永富主任会见北京市委常委、副市长殷勇一行
张庆伟：坚定必胜信心完成最硬任务奋力夺取脱贫攻坚全面胜利,2020/01/10,3661,张庆伟：坚定必胜信心完成最硬任务奋力夺取脱贫攻坚全面胜利
刘永富主任会见中国农业发展银行行长钱文挥一行,2020/01/09,4013,刘永富主任会见中国农业发展银行行长钱文挥一行
刘永富主任会见生态环境部部长李干杰一行,2020/01/08,4264,刘永富主任会见生态环境部部长李干杰一行
聚焦脱贫攻坚展示奋进中国——2020年“新春走基层”活动暨“脱贫攻坚一...,2020/01/08,4951,聚焦脱贫攻坚展示奋进中国——2020年“新春走基层”活动暨“脱贫攻坚一线见闻”主题采访启动
全省农村工作会议暨扶贫脱贫工作会议在石家庄举行,2020/01/06,4357,全省农村工作会议暨扶贫脱贫工作会议在石家庄举行
国务院扶贫开发领导小组全面启动脱贫攻坚收官工作胡春华强调确保剩余贫困...,2020/01/06,6738,国务院扶贫开发领导小组全面启动脱贫攻坚收官工作胡春华强调确保剩余贫困人口全部如期脱贫
刘奇：以群众的获得感评判脱贫攻坚的成效用人民的幸福感检验全面小康的成色,2020/01/05,3791,刘奇：以群众的获得感评判脱贫攻坚的成效用人民的幸福感检验全面小康的成色
石泰峰：全力做好当前和关键之年的工作,2020/01/05,3566,石泰峰：全力做好当前和关键之年的工作
宁夏回族自治区党委常委会召开会议陈润儿主持并讲话,2020/01/05,3641,宁夏回族自治区党委常委会召开会议陈润儿主持并讲话
孙志刚：感受山乡巨变增强“四个自信”为实现“两个一百年”奋斗目标贡献力...,2020/01/05,4230,孙志刚：感受山乡巨变增强“四个自信”为实现“两个一百年”奋斗目标贡献力量
国务院扶贫办召开全办干部职工大会学习贯彻习近平总书记二〇二〇年新年贺词,2020/01/03,5082,国务院扶贫办召开全办干部职工大会学习贯彻习近平总书记二〇二〇年新年贺词
胡春华：一鼓作气、乘势而上坚决夺取脱贫攻坚战的全面胜利,2020/01/03,5947,胡春华：一鼓作气、乘势而上坚决夺取脱贫攻坚战的全面胜利
人民日报刊发宣言署名文章：决胜脱贫在今朝,2020/01/02,8697,人民日报刊发宣言署名文章：决胜脱贫在今朝
刘永富主任会见国家烟草专卖局杨培森副局长一行,2019/12/31,868,刘永富主任会见国家烟草专卖局杨培森副局长一行
王晓东在长阳调研时强调强化政治责任保持攻坚力度高质量打赢脱贫攻坚收官战,2019/12/31,575,王晓东在长阳调研时强调强化政治责任保持攻坚力度高质量打赢脱贫攻坚收官战
蒋超良在省政协重点提案督办工作座谈会上强调同心协力打好打赢脱贫攻坚战,2019/12/31,633,蒋超良在省政协重点提案督办工作座谈会上强调同心协力打好打赢脱贫攻坚战
刘鹤会见朱有勇同志先进事迹报告团时强调奋力谱写新时代科技兴农的新篇章,2019/12/31,697,刘鹤会见朱有勇同志先进事迹报告团时强调奋力谱写新时代科技兴农的新篇章
刘永富主任会见国家电网有限公司总经理辛保安一行,2019/12/31,616,刘永富主任会见国家电网有限公司总经理辛保安一行
刘永富主任会见山东省委常委、常务副省长王书坚一行,2019/12/31,1506,刘永富主任会见山东省委常委、常务副省长王书坚一行
刘永富主任会见北京市朝阳区委书记王灏一行,2019/12/30,1199,刘永富主任会见北京市朝阳区委书记王灏一行
国务院扶贫办召开创建“让党中央放心、让人民群众满意”的模范机关动员大会,2019/12/27,1185,国务院扶贫办召开创建“让党中央放心、让人民群众满意”的模范机关动员大会
王予波：稳搬迁稳产业稳就业稳生活稳人心,2019/12/26,639,王予波：稳搬迁稳产业稳就业稳生活稳人心
胡春华强调高质量打赢脱贫攻坚收官战,2019/12/26,2590,胡春华强调高质量打赢脱贫攻坚收官战
中央农村工作会议在京召开习近平对做好“三农”工作作出重要指示,2019/12/26,2126,中央农村工作会议在京召开习近平对做好“三农”工作作出重要指示
中央第十三巡视组对国务院扶贫开发领导小组办公室党组开展脱贫攻坚专项巡视“...,2019/12/25,2081,中央第十三巡视组对国务院扶贫开发领导小组办公室党组开展脱贫攻坚专项巡视“回头看”
中央脱贫攻坚专项巡视“回头看”启动聚焦巡视整改强化再监督助力如期打赢脱...,2019/12/25,1958,中央脱贫攻坚专项巡视“回头看”启动聚焦巡视整改强化再监督助力如期打赢脱贫攻坚战
中央脱贫攻坚专项巡视“回头看”进驻一览表,2019/12/25,1221,中央脱贫攻坚专项巡视“回头看”进驻一览表
张庆伟：咬定目标一鼓作气发起总攻坚决打赢脱贫攻坚收官之战,2019/12/25,964,张庆伟：咬定目标一鼓作气发起总攻坚决打赢脱贫攻坚收官之战
许达哲主持召开省政府常务会议研究部署“三农”和扶贫等工作,2019/12/24,506,许达哲主持召开省政府常务会议研究部署“三农”和扶贫等工作
全国扶贫开发工作会议在京召开强调一鼓作气乘势而上夺取脱贫攻坚全面胜利,2019/12/20,16566,全国扶贫开发工作会议在京召开强调一鼓作气乘势而上夺取脱贫攻坚全面胜利
胡春华强调坚决如期全面打赢脱贫攻坚战,2019/12/20,4809,胡春华强调坚决如期全面打赢脱贫攻坚战
青海省扶贫开发工作领导小组第七次会议暨省脱贫攻坚中央专项巡视反馈问题整改...,2019/12/19,587,青海省扶贫开发工作领导小组第七次会议暨省脱贫攻坚中央专项巡视反馈问题整改工作领导小组第六次会议召开
胡春华强调确保如期全面完成脱贫攻坚任务,2019/12/18,5664,胡春华强调确保如期全面完成脱贫攻坚任务
汪洋在四川凉山调研时强调突出重点攻坚确保全面小康路上一个民族都不掉队,2019/12/17,1241,汪洋在四川凉山调研时强调突出重点攻坚确保全面小康路上一个民族都不掉队
陕西省委书记胡和平、省长刘国中、省政协主席韩勇会见港澳秦商联合扶贫代表团,2019/12/16,858,陕西省委书记胡和平、省长刘国中、省政协主席韩勇会见港澳秦商联合扶贫代表团
李国英在霍邱、颍上、寿县调研时强调持续推进脱贫安全环境发展重点任务加快...,2019/12/16,514,李国英在霍邱、颍上、寿县调研时强调持续推进脱贫安全环境发展重点任务加快行蓄洪区脱贫攻坚和可持续发展
国务院扶贫办、国家能源局召开全国光伏扶贫工作视频会,2019/12/12,1411,国务院扶贫办、国家能源局召开全国光伏扶贫工作视频会
刘永富主任会见建设银行董事长田国立一行,2019/12/09,2127,刘永富主任会见建设银行董事长田国立一行
刘永富主任会见吉林省委副书记、省长景俊海一行,2019/12/06,2758,刘永富主任会见吉林省委副书记、省长景俊海一行
国务院扶贫办举办社会力量参与扶贫工作培训班,2019/12/06,4066,国务院扶贫办举办社会力量参与扶贫工作培训班
蒋超良：深入学习贯彻四中全会精神确保高质量打赢脱贫攻坚战,2019/12/05,3031,蒋超良：深入学习贯彻四中全会精神确保高质量打赢脱贫攻坚战
刘永富主任会见三峡集团董事长雷鸣山一行,2019/12/04,2881,刘永富主任会见三峡集团董事长雷鸣山一行
刘永富主任会见江苏省委常委、常务副省长樊金龙一行,2019/12/04,3654,刘永富主任会见江苏省委常委、常务副省长樊金龙一行
刘永富主任会见宁波市委副书记、市长裘东耀一行,2019/12/04,3679,刘永富主任会见宁波市委副书记、市长裘东耀一行
李锦斌在亳州宿州淮北调研时强调坚决打赢精准脱贫攻坚战深入实施乡村振兴战...,2019/12/03,3949,李锦斌在亳州宿州淮北调研时强调坚决打赢精准脱贫攻坚战深入实施乡村振兴战略扎实做好“六稳”工作全力推动经济高质量发展
总书记关切脱贫事｜医疗扶贫，照亮贫困家庭的明天,2019/12/03,4857,总书记关切脱贫事｜医疗扶贫，照亮贫困家庭的明天
国务院扶贫办党组理论学习中心组专题学习党的十九届四中全会精神,2019/11/23,2097,国务院扶贫办党组理论学习中心组专题学习党的十九届四中全会精神
国务院扶贫办举办学习党的十九届四中全会精神辅导报告会,2019/11/23,2435,国务院扶贫办举办学习党的十九届四中全会精神辅导报告会
云南坚持目标标准补齐短板弱项确保高质量打赢年度脱贫攻坚战,2019/11/22,1013,云南坚持目标标准补齐短板弱项确保高质量打赢年度脱贫攻坚战
普法丛书乡村走脱贫攻坚好帮手,2019/11/22,1155,普法丛书乡村走脱贫攻坚好帮手
陕西省长刘国中在咸阳宣讲党的十九届四中全会精神调研稳增长脱贫攻坚等重点...,2019/11/21,680,陕西省长刘国中在咸阳宣讲党的十九届四中全会精神调研稳增长脱贫攻坚等重点工作
陕西省委书记胡和平在延安市吴起县调研时强调认真学习贯彻党的十九届四中全会...,2019/11/21,778,陕西省委书记胡和平在延安市吴起县调研时强调认真学习贯彻党的十九届四中全会精神持续推进主题教育脱贫攻坚和生态保护
中央财政下达明年1100多亿元资金助力决战脱贫攻坚,2019/11/20,2432,中央财政下达明年1100多亿元资金助力决战脱贫攻坚
陕西省召开全省贫困县县委书记脱贫攻坚推进会,2019/11/19,2120,陕西省召开全省贫困县县委书记脱贫攻坚推进会
胡和平在省脱贫攻坚领导小组会议上强调咬定目标一鼓作气决战决胜坚决完成年...,2019/11/18,1793,胡和平在省脱贫攻坚领导小组会议上强调咬定目标一鼓作气决战决胜坚决完成年度脱贫攻坚任务
胡春华强调坚决完成深度贫困地区脱贫攻坚任务,2019/11/18,4970,胡春华强调坚决完成深度贫困地区脱贫攻坚任务
许达哲到麻阳指导开展第二批“不忘初心、牢记使命”主题教育时强调以主题教育...,2019/11/15,670,许达哲到麻阳指导开展第二批“不忘初心、牢记使命”主题教育时强调以主题教育为契机推动脱贫攻坚再上新台阶
